,Unnamed: 0,rec_id,Accident number,Competent Department,Competent Center,Amount rating,Date of the accident,The date and time of the notification,Date and time of first arrival,Date and time of completion of control,End date and time of the operation,Departure date and time,Date and time of return to the center,Accident Group,Type of accident,Direct damage,Acccident scene category,Accident scene,Accident title,The band's work summary,Activity,Weather condition,Road condition,Priority level,Accident size,The cause of the accident,The number of injured people,The number of deaths in the public,The number of injured members of the force,The number of deaths of members of the force
0,0,57923,80972,Ras Al Khaimah,Civil Defense Center - Administration,Police and traffic,1/1/2013,2013/01/01-18:45,2013/01/01-18:48,2013/01/01-18:51,1/1/2013 18:52,2013/01/01-18:52,2013/01/01-19:10,Transportation accidents,Clash,the person,residential,residential,Dahan area,Transfer,governmental,No Clouds,natural,Important,basic,Traffic accident,1,0,,
1,1,57924,80973,Ras Al Khaimah,Civil Defense Center - Al -Jazeera Al -Hamra,Police and traffic,1/1/2013,2013/01/01-19:00,2013/01/01-19:04,2013/01/01-19:07,1/1/2013 19:08,2013/01/01-19:08,2013/01/01-20:00,Transportation accidents,Run over,the person,Public facilities and services,governmental,Al -Jazeera Al -Hamra near the cemetery,Transfer,governmental,No Clouds,natural,very important,medium,Traffic accident,0,1,,
2,2,57933,80982,Ajman,Civil Defense Center - Administration,Police and traffic,1/2/2013,2013/01/02-12:57,2013/01/02-13:00,2013/01/02-13:01,1/2/2013 13:02,2013/01/02-13:15,2013/01/02-13:30,Transportation accidents,Clash,Cars,governmental,Streets and squares,Al -Nuaimia area near Edinuk Station,Ambulance and transfer of a person,Missing,No Clouds,natural,Normal,basic,Traffic accident,5,0,,
3,3,57934,80983,Eye,Civil Defense Center - Civil,Police and traffic,1/2/2013,2013/01/02-16:57,2013/01/02-17:08,2013/01/02-17:30,1/2/2013 18:20,2013/01/02-18:25,2013/01/02-18:40,Transportation accidents,Clash,Cars,governmental,bridge,"Ligrarabos, on the main street towards Al Ain",take actions,governmental,No Clouds,natural,Important,basic,Traffic accident,1,0,,
4,4,57954,81003,Ras Al Khaimah,Civil Defense Center - Administration,Police and traffic,1/3/2013,2013/01/03-12:40,2013/01/03-12:45,2013/01/03-12:46,1/3/2013 12:48,2013/01/03-12:49,2013/01/03-13:17,Transportation accidents,Clash,Cars,governmental,Streets and squares,Palm,take actions,governmental,No Clouds,natural,very important,basic,Traffic accident,1,0,,
5,5,57957,81006,Fujairah,Civil Defense Center - Al -Madinah,Police and traffic,1/3/2013,2013/01/03-10:50,2013/01/03-10:52,2013/01/03-10:54,1/3/2013 11:05,2013/01/03-14:27,2013/01/03-14:30,Transportation accidents,Deterioration,Missing,Other places,Streets and squares,Fujairah,Ambulance and transfer of a person,Missing,I did not specify,natural,Important,basic,Traffic accident,1,0,,
6,6,57959,81008,Abu Dhabi,Civil Defense Center - Mossafah (M33),Civil defense departments and centers,1/2/2013,2013/01/02-05:30,2013/01/02-05:36,2013/01/02-06:07,1/2/2013 6:11,2013/01/02-06:52,2013/01/03-07:00,Transportation accidents,Clash,Cars,governmental,unknown,14-Mar,Take bodies,Missing,No Clouds,natural,very important,medium,it is not determined yet,0,1,,
7,7,57962,81011,Al Dhafra,Civil Defense Center - Liwa,he did not specify,1/4/2013,2013/01/04-16:10,2013/01/04-16:13,2013/01/04-16:15,1/4/2013 16:16,2013/01/04-16:17,2013/01/04-16:30,Transportation accidents,Clash,the person,Public facilities and services,Public places and places,"Muzdara area, next to the old association, Liwa",Ambulance and rescue,Cars,No Clouds,natural,Important,basic,Traffic accident,3,0,,
8,8,57963,81012,Ajman,Civil Defense Center - Administration,Police and traffic,1/4/2013,2013/01/04-10:35,2013/01/04-10:36,2013/01/04-10:40,1/4/2013 10:45,2013/01/04-10:50,2013/01/04-10:55,Transportation accidents,Run over,Missing,Other places,Streets and squares,Al Karama District - near Super Gent,Ambulance,Missing,No Clouds,natural,Normal,basic,it is not determined yet,0,0,,
9,9,57988,81037,Ajman,Civil Defense Center - Manama,The audience,1/5/2013,2013/01/05-08:07,2013/01/05-08:10,2013/01/05-08:11,1/5/2013 8:12,2013/01/05-08:13,2013/01/05-08:40,Transportation accidents,Clash,Cars,governmental,Streets and squares,Suhaila General Street area,Ambulance and transfer of a person,Missing,No Clouds,natural,Normal,basic,Traffic accident,1,0,,
10,10,57997,81046,Al Dhafra,Civil Defense Center - Ghayathi,Police and traffic,1/6/2013,2013/01/06-10:10,2013/01/06-10:14,2013/01/06-10:16,1/6/2013 10:18,2013/01/06-10:19,2013/01/06-10:30,Transportation accidents,Clash,Cars,governmental,Public places and places,Two cars collision that resulted in the injury of a person in the chest,take actions,Maintenance of Shaqila equipment,No Clouds,natural,very important,basic,Traffic accident,1,0,,
11,11,58004,81053,Umm Al Quwain,Civil Defense Center - Administration,Police and traffic,1/6/2013,2013/01/06-17:20,2013/01/06-17:24,2013/01/06-17:25,1/6/2013 17:25,2013/01/06-17:27,2013/01/06-18:08,Transportation accidents,Clash,Cars,Public facilities and services,Public places and places,Salama area,Ambulance and transfer of a person,Cars,No Clouds,natural,Normal,basic,Traffic accident,1,0,,
12,12,58011,81060,Ajman,Civil Defense Center - Administration,Police and traffic,1/6/2013,2013/01/06-19:49,2013/01/06-19:52,2013/01/06-19:55,1/6/2013 19:56,2013/01/06-19:58,2013/01/06-20:32,Transportation accidents,Clash,Missing,Means of transport,Other places,Al Jarf Region - Industrial 1,Ambulance and rescue,Cars,No Clouds,natural,very important,basic,Traffic accident,2,0,,
13,13,58037,81086,Umm Al Quwain,Civil Defense Center - Administration,Police and traffic,1/8/2013,2013/01/08-13:30,2013/01/08-13:34,2013/01/08-13:36,1/8/2013 13:36,2013/01/08-13:37,2013/01/08-13:53,Transportation accidents,Deterioration,the person,Other places,Streets and squares,The navel area is near the navel bridge,Transfer,Missing,No Clouds,natural,unclassified,basic,Traffic accident,1,0,,
14,14,58039,81088,Ajman,Civil Defense Center - Administration,The audience,1/8/2013,2013/01/08-16:30,2013/01/08-16:34,2013/01/08-16:35,1/8/2013 16:39,2013/01/08-16:45,2013/01/08-17:45,Transportation accidents,Clash,Cars,governmental,Streets and squares,Al -Jarf area near the Chinese market,Directing and transporting bodies,Missing,No Clouds,natural,Important,basic,Traffic accident,1,0,,
15,15,58042,81091,Ras Al Khaimah,Civil Defense Center - Northern Administration,Police and traffic,1/9/2013,2013/01/09-05:39,2013/01/09-05:43,2013/01/09-05:47,1/9/2013 5:48,2013/01/09-05:50,2013/01/09-06:51,Transportation accidents,Run over,Missing,governmental,Streets and squares,"Khor Khuwair, public street",take actions,Missing,No Clouds,natural,very important,medium,it is not determined yet,0,1,,
16,16,58045,81094,Ras Al Khaimah,Civil Defense Center - Administration,Police and traffic,1/9/2013,2013/01/09-08:45,2013/01/09-08:49,2013/01/09-08:53,1/9/2013 8:54,2013/01/09-08:54,2013/01/09-09:18,Transportation accidents,Deterioration,the person,Public facilities and services,Streets and squares,Palm Old Communications Street,Transfer,governmental,No Clouds,natural,Important,basic,Traffic accident,1,0,,
17,17,58052,81101,Al Dhafra,Civil Defense Center - Port,Police and traffic,1/9/2013,2013/01/09-19:45,2013/01/09-20:00,2013/01/09-20:10,1/9/2013 20:18,2013/01/09-20:55,2013/01/09-21:10,Transportation accidents,Clash,Cars,governmental,Streets and squares,crash accident,Ambulance and rescue,Cars,No Clouds,natural,Normal,basic,Traffic accident,2,0,,
18,18,58053,81102,Ras Al Khaimah,Civil Defense Center - Administration,Police and traffic,1/9/2013,2013/01/09-22:24,2013/01/09-22:27,2013/01/09-22:30,1/9/2013 22:31,2013/01/09-22:31,2013/01/09-22:50,Transportation accidents,Clash,the person,tourist,commercial,Palm against Al -Jaidi,Transfer,governmental,No Clouds,natural,Important,basic,Traffic accident,1,0,,
19,19,58054,81103,Ras Al Khaimah,Civil Defense Center - Administration,The audience,1/10/2013,2013/01/10-08:10,2013/01/10-08:17,2013/01/10-08:19,1/10/2013 8:21,2013/01/10-08:22,2013/01/10-09:05,Transportation accidents,Clash,the person,governmental,Streets and squares,Next to the quality school,Ambulance and transfer of a person,Missing,No Clouds,natural,very important,basic,Traffic accident,1,0,,
20,20,58099,81148,Ras Al Khaimah,Civil Defense Center - Administration,Police and traffic,1/12/2013,2013/01/12-14:48,2013/01/12-14:58,2013/01/12-15:02,1/12/2013 15:04,2013/01/12-15:07,2013/01/12-15:43,Transportation accidents,Deterioration,Missing,governmental,unknown,Sheikh Mohammed bin Zayed Street,take actions,Missing,No Clouds,natural,Important,basic,Traffic accident,1,0,,
21,21,58103,81152,Ras Al Khaimah,Civil Defense Center - Administration,Police and traffic,1/12/2013,2013/01/12-17:28,2013/01/12-17:30,2013/01/12-17:31,1/12/2013 17:35,2013/01/12-17:38,2013/01/12-18:10,Transportation accidents,Clash,the person,governmental,Streets and squares,Golan,Ambulance and transfer of a person,Missing,No Clouds,natural,Important,basic,Traffic accident,1,0,,
22,22,58120,81169,Ras Al Khaimah,Civil Defense Center - Administration,Police and traffic,1/13/2013,2013/01/13-13:32,2013/01/13-13:35,2013/01/13-13:38,1/13/2013 13:39,2013/01/13-13:39,2013/01/13-15:00,Transportation accidents,Clash,the person,Public facilities and services,Public places and places,Julpar opposite Rotana washbasin,Transfer,governmental,No Clouds,natural,very important,basic,Traffic accident,1,0,,
23,23,58124,81173,Ras Al Khaimah,Civil Defense Center - Administration,Police and traffic,1/13/2013,2013/01/13-21:01,2013/01/13-21:04,2013/01/13-21:07,1/13/2013 21:08,2013/01/13-21:08,2013/01/13-21:53,Transportation accidents,Clash,the person,residential,Streets and squares,Barirat,Transfer,governmental,No Clouds,natural,very important,basic,Traffic accident,4,0,,
24,24,58126,81175,Ras Al Khaimah,Civil Defense Center - Administration,Police and traffic,1/14/2013,2013/01/14-11:29,2013/01/14-11:31,2013/01/14-11:33,1/14/2013 11:35,2013/01/14-12:14,2013/01/14-12:19,Transportation accidents,Clash,the person,Public facilities and services,Streets and squares,Communications Street - Palm,Ambulance and transfer of a person,Missing,No Clouds,natural,Normal,basic,it is not determined yet,1,0,,
25,25,58130,81179,Sharjah,Civil Defense Center - Al -Sajaa,Police and traffic,1/14/2013,2013/01/14-16:49,2013/01/14-16:53,2013/01/14-16:55,1/14/2013 17:23,2013/01/14-17:25,2013/01/14-17:30,Transportation accidents,a fire,Cars,governmental,Streets and squares,From Bridge 6 to the Rahmaniyah area,take actions,Missing,No Clouds,natural,very important,medium,Traffic accident,0,1,,
26,26,58131,81180,Ras Al Khaimah,Civil Defense Center - Administration,Police and traffic,1/14/2013,2013/01/14-18:09,2013/01/14-18:15,2013/01/14-18:17,1/14/2013 18:19,2013/01/14-18:21,2013/01/14-19:05,Transportation accidents,Clash,the person,governmental,Streets and squares,Near the Julphar Health Center in the Eastern Region,Ambulance and transfer of a person,Missing,No Clouds,natural,very important,basic,it is not determined yet,1,0,,
27,27,58139,81188,Al Dhafra,Civil Defense Center - Liwa,Police and traffic,1/15/2013,2013/01/15-17:10,2013/01/15-17:25,2013/01/15-17:26,1/15/2013 17:27,2013/01/15-17:28,2013/01/15-17:40,Transportation accidents,One hundredth,Electricity column,Other places,Other places,Al -Tarawaniyah Road Liwa - Hmeim,Transfer,Missing,No Clouds,natural,Normal,basic,Traffic accident,1,0,,
28,28,58140,81189,Ras Al Khaimah,Civil Defense Center - Administration,Police and traffic,1/15/2013,2013/01/15-19:10,2013/01/15-19:13,2013/01/15-19:15,1/15/2013 19:17,2013/01/15-19:18,2013/01/15-19:55,Transportation accidents,Clash,the person,governmental,Streets and squares,Palm area,Ambulance and transfer of a person,Missing,No Clouds,natural,very important,basic,Traffic accident,1,0,,
29,29,58153,81202,Fujairah,Civil Defense Center - Dibba,The audience,1/16/2013,2013/01/16-14:53,2013/01/16-14:57,2013/01/16-14:59,1/16/2013 15:00,2013/01/16-15:09,2013/01/16-15:12,Transportation accidents,Clash,Cars,Public facilities and services,Streets and squares,"Dibba Al -Fujairah, the apostasy area",Exit and transfer injured people,Missing,No Clouds,natural,Important,basic,Traffic accident,1,0,,
30,30,58156,81205,Ras Al Khaimah,Civil Defense Center - Administration,The audience,1/16/2013,2013/01/16-21:25,2013/01/16-21:28,2013/01/16-21:30,1/16/2013 21:32,2013/01/16-21:33,2013/01/16-22:04,Transportation accidents,Clash,Missing,governmental,Streets and squares,Explanation Street,Ambulance,governmental,No Clouds,natural,Important,basic,Traffic accident,1,0,,
31,31,58172,81221,Ras Al Khaimah,Civil Defense Center - Al -Jazeera Al -Hamra,Police and traffic,1/18/2013,2013/01/18-03:15,2013/01/18-03:17,2013/01/18-03:37,1/18/2013 3:38,2013/01/18-03:40,2013/01/18-03:52,Transportation accidents,Deterioration,the person,Public facilities and services,Streets and squares,Al -Jazeera Al -Hamra - Al -Ittihad Street - opposite ceramic,Ambulance and transfer of a person,Missing,No Clouds,natural,Normal,basic,it is not determined yet,2,0,,
32,32,58174,81223,Ras Al Khaimah,Civil Defense Center - Al -Jazeera Al -Hamra,Police and traffic,1/18/2013,2013/01/18-09:17,2013/01/18-09:20,2013/01/18-09:22,1/18/2013 9:25,2013/01/18-09:55,2013/01/18-10:11,Transportation accidents,Deterioration,the person,Public facilities and services,Streets and squares,Near the markets of the oasis - Al -Jazeera Al -Hamra,Ambulance and transfer of a person,Missing,No Clouds,natural,Normal,basic,it is not determined yet,1,0,,
33,33,58180,81229,Ras Al Khaimah,Civil Defense Center - Al -Jazeera Al -Hamra,Police and traffic,1/18/2013,2013/01/18-12:05,2013/01/18-12:06,2013/01/18-12:08,1/18/2013 12:10,2013/01/18-12:12,2013/01/18-12:49,Transportation accidents,Deterioration,the person,Other places,Streets and squares,Al -Jazeera Red Street,Ambulance and transfer of a person,Missing,No Clouds,natural,very important,basic,it is not determined yet,1,0,,
34,34,58194,81243,Ras Al Khaimah,Civil Defense Center - Administration,Police and traffic,1/19/2013,2013/01/19-11:00,2013/01/19-11:01,2013/01/19-11:03,1/19/2013 11:05,2013/01/19-11:06,2013/01/19-11:25,Transportation accidents,Clash,the person,governmental,Streets and squares,In front of the Julpar Towers,Ambulance and transfer of a person,Missing,No Clouds,natural,very important,basic,Traffic accident,1,0,,
35,35,58195,81244,Ras Al Khaimah,Civil Defense Center - Al -Jazeera Al -Hamra,Police and traffic,1/19/2013,2013/01/19-11:25,2013/01/19-11:28,2013/01/19-11:30,1/19/2013 11:32,2013/01/19-11:33,2013/01/19-12:30,Transportation accidents,One hundredth,the person,governmental,Streets and squares,Al-Jazeera Al-Hamra-Free Zone,Ambulance and transfer of a person,Missing,No Clouds,natural,very important,basic,Traffic accident,1,0,,
36,36,58217,81266,Ras Al Khaimah,Civil Defense Center - Administration,Police and traffic,1/20/2013,2013/01/20-15:50,2013/01/20-15:53,2013/01/20-15:55,1/20/2013 16:00,2013/01/20-16:03,2013/01/20-16:29,Transportation accidents,Clash,the person,governmental,Streets and squares,The Golan Shish area,Ambulance and transfer of a person,Missing,No Clouds,natural,Important,basic,Traffic accident,1,0,,
37,37,58219,81268,Ras Al Khaimah,Civil Defense Center - Al -Jazeera Al -Hamra,Police and traffic,1/20/2013,2013/01/20-16:51,2013/01/20-16:57,2013/01/20-16:59,1/20/2013 17:04,2013/01/20-17:06,2013/01/20-17:25,Transportation accidents,Clash,the person,governmental,Streets and squares,Sheikh Mohammed bin Zayed Street,Ambulance and transfer of a person,Missing,No Clouds,natural,Important,basic,Traffic accident,1,0,,
38,38,58220,81269,Ras Al Khaimah,Civil Defense Center - Administration,Police and traffic,1/20/2013,2013/01/20-18:53,2013/01/20-18:55,2013/01/20-18:58,1/20/2013 19:00,2013/01/20-19:07,2013/01/20-19:26,Transportation accidents,Run over,Missing,governmental,unknown,Palm,take actions,Missing,No Clouds,natural,Important,basic,Traffic accident,1,0,,
39,39,58222,81271,Ras Al Khaimah,Civil Defense Center - Al -Jazeera Al -Hamra,Police and traffic,1/20/2013,2013/01/21-22:33,2013/01/21-22:35,2013/01/21-22:37,1/21/2013 22:40,2013/01/21-22:42,2013/01/21-23:00,Transportation accidents,Clash,the person,governmental,Streets and squares,Al -Jazeera Al -Hamra in front of the ceramic company,Ambulance and transfer of a person,Missing,No Clouds,natural,Important,basic,Traffic accident,1,0,,
40,40,58226,81275,Al Dhafra,Civil Defense Center - Liwa,Police and traffic,1/21/2013,2013/01/21-08:45,2013/01/21-09:15,2013/01/21-09:30,1/21/2013 9:40,2013/01/21-09:45,2013/01/21-10:15,Transportation accidents,Deterioration,Cars,governmental,Streets and squares,Car deterioration,take actions,Cars,No Clouds,natural,Normal,basic,Traffic accident,1,0,,
41,41,58228,81277,Ras Al Khaimah,Civil Defense Center - Administration,Police and traffic,1/21/2013,2013/01/21-12:19,2013/01/21-12:22,2013/01/21-12:25,1/21/2013 12:26,2013/01/21-12:26,2013/01/21-12:55,Transportation accidents,a fire,the person,Public facilities and services,Streets and squares,Palm,Transfer,governmental,No Clouds,natural,very important,basic,Traffic accident,1,0,,
42,42,58235,81284,Ras Al Khaimah,Civil Defense Center - Administration,Police and traffic,1/22/2013,2013/01/22-04:48,2013/01/22-04:52,2013/01/22-04:55,1/22/2013 4:56,2013/01/22-04:56,2013/01/22-05:30,Transportation accidents,Clash,the person,Public facilities and services,Streets and squares,Reunion,Transfer,governmental,No Clouds,natural,very important,basic,Traffic accident,1,0,,
43,43,58239,81288,Ras Al Khaimah,Civil Defense Center - Administration,Police and traffic,1/21/2013,2013/01/21-10:49,2013/01/21-10:52,2013/01/21-10:53,1/21/2013 10:55,2013/01/21-10:56,2013/01/21-11:45,Transportation accidents,Clash,the person,governmental,governmental,Zahra area,take actions,Missing,No Clouds,natural,very important,basic,Traffic accident,2,0,,
44,44,58253,81302,Ras Al Khaimah,Civil Defense Center - Administration,Police and traffic,1/23/2013,2013/01/23-05:18,2013/01/23-05:20,2013/01/23-05:22,1/23/2013 5:25,2013/01/23-05:45,2013/01/23-05:50,Transportation accidents,Run over,the person,Public facilities and services,Streets and squares,Palm - Cinema intersection,Ambulance and transfer of a person,Missing,No Clouds,natural,Normal,basic,it is not determined yet,1,0,,
45,45,58258,81307,Ras Al Khaimah,Civil Defense Center - Al -Jazeera Al -Hamra,Police and traffic,1/23/2013,2013/01/23-12:55,2013/01/23-13:00,2013/01/23-13:03,1/23/2013 13:06,2013/01/23-13:08,2013/01/23-13:55,Transportation accidents,One hundredth,the person,Other places,Institutions and companies,Al -Jazeera Al -Hamra area in the free zone,Ambulance and transfer of a person,Missing,No Clouds,natural,very important,basic,it is not determined yet,1,0,,
46,46,58261,81310,Al Dhafra,Civil Defense Center - Port,Police and traffic,1/23/2013,2013/01/23-15:15,2013/01/23-15:25,2013/01/23-15:30,1/23/2013 15:36,2013/01/23-15:37,2013/01/23-15:45,Transportation accidents,Deterioration,the person,governmental,Streets and squares,Deterioration,Transfer,governmental,No Clouds,natural,Normal,basic,Traffic accident,4,0,,
47,47,58271,81320,Ras Al Khaimah,Civil Defense Center - Administration,Police and traffic,1/24/2013,2013/01/24-08:10,2013/01/24-08:15,2013/01/24-08:17,1/24/2013 8:24,2013/01/24-08:26,2013/01/24-09:10,Transportation accidents,Clash,the person,governmental,Streets and squares,Julpar Street,Rescue and transfer injured people,Missing,No Clouds,natural,very important,basic,Traffic accident,5,0,,
48,48,58274,81323,Ras Al Khaimah,Civil Defense Center - Al -Jazeera Al -Hamra,Police and traffic,1/24/2013,2013/01/24-18:30,2013/01/24-18:37,2013/01/24-18:39,1/24/2013 18:43,2013/01/24-18:45,2013/01/24-19:24,Transportation accidents,Clash,the person,governmental,Streets and squares,Al -Tawiyan Street at Al -Saadi roundabout,Ambulance and transfer of a person,Missing,No Clouds,natural,Important,basic,Traffic accident,1,0,,
49,49,58303,81352,Ras Al Khaimah,Civil Defense Center - Administration,Police and traffic,1/26/2013,2013/01/26-20:37,2013/01/26-20:40,2013/01/26-20:43,1/26/2013 20:45,2013/01/26-21:07,2013/01/26-21:12,Transportation accidents,Clash,the person,Public facilities and services,Streets and squares,Palm - near the Kerala supermarket,Ambulance and transfer of a person,Missing,No Clouds,natural,Normal,basic,it is not determined yet,2,0,,
50,50,58326,81375,Fujairah,Civil Defense Center - against us,The audience,1/28/2013,2013/01/28-08:48,2013/01/28-08:51,2013/01/28-08:52,1/28/2013 8:53,2013/01/28-08:55,2013/01/28-09:00,Transportation accidents,One hundredth,Cars,Public facilities and services,Streets and squares,Aqa area,Exit and transfer injured people,Missing,No Clouds,natural,Important,basic,Traffic accident,1,0,,
51,51,58358,81407,Ras Al Khaimah,Civil Defense Center - Kadra,Police and traffic,1/30/2013,2013/01/30-19:45,2013/01/30-19:46,2013/01/30-19:48,1/30/2013 19:50,2013/01/30-20:35,2013/01/30-20:40,Transportation accidents,Clash,the person,Public facilities and services,Streets and squares,Kadra Street - opposite the poultry,Ambulance and transfer of a person,Missing,No Clouds,natural,Normal,basic,it is not determined yet,1,0,,
52,52,58362,81411,Ras Al Khaimah,Civil Defense Center - Administration,Police and traffic,1/31/2013,2013/01/31-12:03,2013/01/31-12:06,2013/01/31-12:08,1/31/2013 12:10,2013/01/31-12:11,2013/01/31-12:45,Transportation accidents,Run over,the person,governmental,Streets and squares,Near the Gulf Cinema,Ambulance and transfer of a person,Missing,No Clouds,natural,very important,basic,Traffic accident,1,0,,
53,53,58363,81412,Ras Al Khaimah,Civil Defense Center - Northern Administration,Police and traffic,1/31/2013,2013/01/31-14:14,2013/01/31-14:28,2013/01/31-14:32,1/31/2013 14:34,2013/01/31-14:36,2013/01/31-15:32,Transportation accidents,Clash,the person,governmental,Streets and squares,Lime- Ras Al Dar,Ambulance and transfer of a person,Missing,No Clouds,natural,very important,basic,Traffic accident,3,0,,
54,54,58380,81429,Umm Al Quwain,Civil Defense Center - Administration,Police and traffic,2/1/2013,2013/02/01-18:42,2013/02/01-18:46,2013/02/01-18:47,2/1/2013 18:48,2013/02/01-18:55,2013/02/01-19:30,Transportation accidents,Clash,the person,governmental,Streets and squares,Etihad Street - external circle,Transfer,Missing,No Clouds,natural,Normal,basic,Traffic accident,1,0,,
55,55,58381,81430,Ras Al Khaimah,Civil Defense Center - Al -Jazeera Al -Hamra,Police and traffic,2/1/2013,2013/02/01-19:46,2013/02/01-19:49,2013/02/01-19:51,2/1/2013 19:54,2013/02/01-20:00,2013/02/01-20:51,Transportation accidents,Run over,the person,governmental,Streets and squares,The Red Island is at Majan for printing,Ambulance and transfer of a person,Missing,No Clouds,natural,Important,basic,Traffic accident,1,0,,
56,56,58382,81431,Eye,Civil Defense Center - Al -Qaa,Police and traffic,2/1/2013,2013/02/01-21:27,2013/02/01-21:33,2013/02/01-21:48,2/1/2013 21:58,2013/02/01-22:10,2013/02/01-22:17,Transportation accidents,Clash,Cars,Public facilities and services,Streets and squares,Al -Qalia Road - Al -Waqen,Fire fighting,Cars,No Clouds,natural,very important,basic,it is not determined yet,4,0,,
57,57,58384,81433,Umm Al Quwain,Civil Defense Center - Al -Madinah,Police and traffic,2/1/2013,2013/02/01-19:30,2013/02/01-19:32,2013/02/01-19:33,2/1/2013 19:33,2013/02/01-19:37,2013/02/01-19:41,Transportation accidents,Clash,the person,Public facilities and services,Streets and squares,King Faisal Street opposite the Sheikh Zayed Mosque,Transfer,Cars,No Clouds,natural,unclassified,basic,Traffic accident,2,0,,
58,58,58393,81442,Umm Al Quwain,Civil Defense Center - Al -Madinah,Police and traffic,2/2/2013,2013/02/02-15:43,2013/02/02-15:46,2013/02/02-15:48,2/2/2013 15:50,2013/02/02-15:51,2013/02/02-16:16,Transportation accidents,Clash,Cars,Public facilities and services,Public places and places,King Faisal Street opposite the Sheikh Zayed Mosque,Transfer,Cars,Rains,natural,Normal,basic,Traffic accident,2,0,,
59,59,58406,81455,Fujairah,Civil Defense Center - Dibba,Police and traffic,2/2/2013,2013/02/02-18:55,2013/02/02-19:02,2013/02/02-19:05,2/2/2013 19:06,2013/02/02-19:07,2013/02/02-19:40,Transportation accidents,Clash,Missing,residential,Streets and squares,Roll Dibba Fujairah,Transfer,Missing,I did not specify,natural,Important,basic,Traffic accident,1,0,,
60,60,58468,81517,Eye,Civil Defense Center - Zakher (fast intervention),Police and traffic,2/4/2013,2013/02/04-08:12,2013/02/04-08:25,2013/02/04-10:00,2/4/2013 13:20,2013/02/04-13:22,2013/02/04-14:30,Transportation accidents,Clash,Cars,Public facilities and services,Various transportation,Truck Road - opposite the Kindergarten Palace,Recovery and raise a car,Cars,No Clouds,natural,Important,disaster,Traffic accident,23,20,,
61,61,58469,81518,Al Dhafra,Civil Defense Center - Ghuifat,Police and traffic,2/4/2013,2013/02/04-14:15,2013/02/04-14:20,2013/02/04-14:28,2/4/2013 14:32,2013/02/04-14:33,2013/02/04-15:30,Transportation accidents,Deterioration,Missing,governmental,unknown,Missing,take actions,furniture,No Clouds,natural,very important,basic,Traffic accident,1,0,,
62,62,58473,81522,Fujairah,Civil Defense Center - Al -Madinah,Police and traffic,2/4/2013,2013/02/04-03:45,2013/02/04-03:48,2013/02/04-03:51,2/4/2013 3:56,2013/02/04-04:05,2013/02/04-04:10,Transportation accidents,Deterioration,Cars,governmental,unknown,Palm Street,cooling,Missing,No Clouds,natural,very important,basic,Traffic accident,1,0,,
63,63,58486,81535,Abu Dhabi,Rapid Intervention Center - Mohammed bin Zayed,Police and traffic,2/2/2013,2013/02/02-16:15,2013/02/02-16:25,2013/02/02-16:30,2/2/2013 19:35,2013/02/02-19:35,2013/02/05-19:35,Transportation accidents,Deterioration,Trucks,Means of transport,unknown,Abu Dhabi International Airport Bridge,Recovery and raise a car,Cars,No Clouds,natural,very important,medium,it is not determined yet,0,1,,
64,64,58489,81538,Umm Al Quwain,Raise Center,Police and traffic,2/5/2013,2013/02/05-16:10,2013/02/05-16:12,2013/02/05-16:15,2/5/2013 16:17,2013/02/05-16:18,2013/02/05-16:47,Transportation accidents,Deterioration,Cars,Public facilities and services,Public places and places,Etihad Street near Dreamland Park,Transfer,Cars,No Clouds,natural,Normal,basic,it is not determined yet,2,0,,
65,65,58491,81540,Fujairah,Civil Defense Center - Al -Taween,Military officers and members,2/5/2013,2013/02/05-17:10,2013/02/05-17:15,2013/02/05-17:16,2/5/2013 17:30,2013/02/05-17:40,2013/02/05-18:00,Transportation accidents,Clash,Missing,Public facilities and services,Streets and squares,And the defect of Al -Hanna - Dibba Al -Fujairah,Ambulance and rescue,Missing,I did not specify,natural,Important,basic,Traffic accident,1,0,,
66,66,58504,81553,Ras Al Khaimah,Civil Defense Center - Administration,Police and traffic,2/6/2013,2013/02/06-14:05,2013/02/06-14:09,2013/02/06-14:12,2/6/2013 14:20,2013/02/06-14:20,2013/02/06-14:35,Transportation accidents,Clash,the person,commercial,unknown,In front of Al -Sahari Restaurant,Transfer,governmental,No Clouds,natural,Important,basic,Traffic accident,1,0,,
67,67,58512,81561,Ras Al Khaimah,Civil Defense Center - Administration,Police and traffic,2/6/2013,2013/02/06-23:06,2013/02/06-23:08,2013/02/06-23:11,2/6/2013 23:12,2013/02/06-23:12,2013/02/06-23:35,Transportation accidents,Run over,the person,governmental,residential,Al -Uraibi,Transfer,governmental,No Clouds,natural,Important,basic,Traffic accident,1,0,,
68,68,58518,81567,Ras Al Khaimah,Civil Defense Center - Administration,Police and traffic,2/7/2013,2013/02/07-15:13,2013/02/07-15:17,2013/02/07-15:20,2/7/2013 15:22,2013/02/07-15:36,2013/02/07-15:41,Transportation accidents,Clash,the person,Public facilities and services,Streets and squares,Al -Mairid Street - Al -Mairid Street,Ambulance and transfer of a person,Missing,No Clouds,natural,Normal,basic,Traffic accident,2,0,,
69,69,58520,81569,Ras Al Khaimah,Civil Defense Center - Administration,Police and traffic,2/7/2013,2013/02/07-13:19,2013/02/07-13:23,2013/02/07-13:25,2/7/2013 13:28,2013/02/07-13:45,2013/02/07-13:50,Transportation accidents,Run over,the person,Public facilities and services,Streets and squares,Rams Street - near the Spring of Lebanon Bakery,Ambulance and transfer of a person,Missing,No Clouds,natural,Normal,basic,it is not determined yet,1,0,,
70,70,58525,81574,Ras Al Khaimah,Civil Defense Center - Administration,Police and traffic,2/8/2013,2013/02/08-00:59,2013/02/08-01:01,2013/02/08-01:04,2/8/2013 1:08,2013/02/08-01:11,2013/02/08-01:50,Transportation accidents,Clash,the person,governmental,Streets and squares,Opposite,Ambulance and transfer of a person,Missing,No Clouds,natural,very important,basic,it is not determined yet,2,0,,
71,71,58526,81575,Abu Dhabi,Civil Defense Center - Gentot,Civil defense departments and centers,2/7/2013,2013/02/07-16:10,2013/02/07-16:20,2013/02/07-18:27,2/7/2013 18:40,2013/02/07-18:41,2013/02/07-18:46,Transportation accidents,a fire,Cars,Means of transport,car,Before Alfaya roundabout,Ambulance and transfer of injured and deceased,Cars,No Clouds,natural,very important,medium,it is not determined yet,5,1,,
72,72,58529,81578,Ras Al Khaimah,Civil Defense Center - Administration,Police and traffic,2/8/2013,2013/02/08-05:39,2013/02/08-05:40,2013/02/08-05:43,2/8/2013 5:46,2013/02/08-05:49,2013/02/08-06:30,Transportation accidents,Clash,the person,governmental,Streets and squares,Rams Street - Al Nakheel,Ambulance and transfer of a person,Missing,No Clouds,natural,very important,basic,it is not determined yet,1,0,,
73,73,58530,81579,Umm Al Quwain,Raise Center,Police and traffic,2/8/2013,2013/02/08-05:29,2013/02/08-05:40,2013/02/08-05:42,2/8/2013 5:43,2013/02/08-06:00,2013/02/08-07:00,Transportation accidents,Deterioration,the person,governmental,Streets and squares,Al -Abeer Street towards the exit 103 near the rescue point,Transfer,Missing,No Clouds,natural,unclassified,basic,Traffic accident,3,0,,
74,74,58536,81585,Ajman,Civil Defense Center - Manama,Police and traffic,2/8/2013,2013/02/08-15:10,2013/02/08-15:15,2013/02/08-15:17,2/8/2013 15:19,2013/02/08-15:22,2013/02/08-16:15,Transportation accidents,Deterioration,Cars,Means of transport,car,Car deterioration,take actions,Cars,No Clouds,natural,very important,basic,it is not determined yet,1,0,,
75,75,58544,81593,Fujairah,Civil Defense Center - Masafi,Police and traffic,2/8/2013,2013/02/08-19:32,2013/02/08-19:34,2013/02/08-19:35,2/8/2013 19:36,2013/02/08-19:37,2013/02/08-19:39,Transportation accidents,Clash,Missing,Public facilities and services,Streets and squares,Massafi Fujairah,Transfer,Missing,I did not specify,natural,Normal,basic,Traffic accident,6,0,,
76,76,58545,81594,Al Dhafra,Civil Defense Center - Liwa,Police and traffic,2/9/2013,2013/02/09-01:15,2013/02/09-02:05,2013/02/09-02:20,2/9/2013 2:26,2013/02/09-02:42,2013/02/09-03:44,Transportation accidents,Deterioration,Missing,governmental,undefined,"Dowry accident in an intimate area, 80 km away",take actions,furniture,No Clouds,natural,very important,basic,Traffic accident,2,0,,
77,77,58547,81596,Eye,Civil Defense Center - Al -Wajan,Police and traffic,2/9/2013,2013/02/09-08:26,2013/02/09-08:46,2013/02/09-10:01,2/9/2013 10:24,2013/02/09-10:25,2013/02/09-10:30,Transportation accidents,Clash,Cars,Means of transport,Streets and squares,"Al -Arad area, Bouqariya Road",Fire control and cooling,Specific,No Clouds,natural,very important,medium,it is not determined yet,7,1,,
78,78,58554,81603,Ras Al Khaimah,Civil Defense Center - Administration,Police and traffic,2/9/2013,2013/02/09-16:19,2013/02/09-16:22,2013/02/09-16:24,2/9/2013 16:27,2013/02/09-16:30,2013/02/09-16:55,Transportation accidents,Clash,Missing,governmental,Public places and places,Golan Street,take actions,Missing,No Clouds,natural,Important,basic,Traffic accident,2,0,,
79,79,58562,81611,Al Dhafra,Civil Defense Center - Liwa,The audience,2/10/2013,2013/02/10-13:16,2013/02/10-13:25,2013/02/10-13:26,2/10/2013 13:28,2013/02/10-13:45,2013/02/10-14:15,Transportation accidents,Clash,Cars,Public facilities and services,Other places,Liwa/intimate road (Al -Hawattin) area after 20 km from the center,take actions,Cars,No Clouds,natural,Important,medium,Traffic accident,0,1,,
80,80,58580,81629,Umm Al Quwain,Civil Defense Center - Administration,Police and traffic,2/11/2013,2013/02/11-17:43,2013/02/11-17:47,2013/02/11-17:49,2/11/2013 17:50,2013/02/11-17:51,2013/02/11-18:16,Transportation accidents,Deterioration,Cars,Public facilities and services,Public places and places,The outer round,Transfer,Cars,No Clouds,natural,Normal,basic,Traffic accident,2,0,,
81,81,58582,81631,Ras Al Khaimah,Civil Defense Center - Northern Administration,Police and traffic,2/11/2013,2013/02/11-19:17,2013/02/11-19:22,2013/02/11-19:24,2/11/2013 19:26,2013/02/11-20:00,2013/02/11-20:12,Transportation accidents,Clash,the person,Public facilities and services,Streets and squares,Shamal Al Ras Street - opposite the Inter Lock Factory,Ambulance and transfer of a person,Missing,No Clouds,natural,Normal,basic,it is not determined yet,2,0,,
82,82,58585,81634,Ras Al Khaimah,Civil Defense Center - Al -Jazeera Al -Hamra,Police and traffic,2/11/2013,2013/02/11-19:42,2013/02/11-19:43,2013/02/11-19:46,2/11/2013 19:49,2013/02/11-20:15,2013/02/11-20:30,Transportation accidents,Clash,the person,Public facilities and services,Streets and squares,Al -Jazeera Al -Hamra - near the Civil Defense Center,Ambulance and transfer of a person,Missing,No Clouds,natural,Normal,basic,it is not determined yet,2,0,,
83,83,58586,81635,Ras Al Khaimah,Civil Defense Center - Al -Jazeera Al -Hamra,Police and traffic,2/11/2013,2013/02/11-19:42,2013/02/11-19:43,2013/02/11-19:46,2/11/2013 19:49,2013/02/11-20:15,2013/02/11-20:30,Transportation accidents,Clash,the person,Public facilities and services,Streets and squares,Al -Jazeera Al -Hamra - near the Civil Defense Center,Ambulance and transfer of a person,Missing,No Clouds,natural,Normal,basic,it is not determined yet,2,0,,
84,84,58587,81636,Ras Al Khaimah,Civil Defense Center - Al -Jazeera Al -Hamra,Police and traffic,2/11/2013,2013/02/11-19:42,2013/02/11-19:43,2013/02/11-19:46,2/11/2013 19:49,2013/02/11-20:15,2013/02/11-20:30,Transportation accidents,Clash,the person,Public facilities and services,Streets and squares,Al -Jazeera Al -Hamra - near the Civil Defense Center,Ambulance and transfer of a person,Missing,No Clouds,natural,Normal,basic,it is not determined yet,2,0,,
85,85,58588,81637,Ras Al Khaimah,Civil Defense Center - Al -Jazeera Al -Hamra,Police and traffic,2/11/2013,2013/02/11-19:42,2013/02/11-19:43,2013/02/11-19:46,2/11/2013 19:49,2013/02/11-20:15,2013/02/11-20:30,Transportation accidents,Clash,the person,Public facilities and services,Streets and squares,Al -Jazeera Al -Hamra - near the Civil Defense Center,Ambulance and transfer of a person,Missing,No Clouds,natural,Normal,basic,it is not determined yet,2,0,,
86,86,58593,81642,Ras Al Khaimah,Civil Defense Center - Administration,Police and traffic,2/11/2013,2013/02/11-23:30,2013/02/11-23:32,2013/02/11-23:34,2/11/2013 23:35,2013/02/11-23:55,2013/02/12-00:00,Transportation accidents,Clash,the person,Public facilities and services,Streets and squares,Al -Uraibi Street,Ambulance and transfer of a person,Missing,No Clouds,natural,Normal,basic,Traffic accident,1,0,,
87,87,58594,81643,Ras Al Khaimah,Civil Defense Center - Administration,Police and traffic,2/12/2013,2013/02/12-00:31,2013/02/12-00:34,2013/02/12-00:36,2/12/2013 0:40,2013/02/12-01:10,2013/02/12-01:20,Transportation accidents,Run over,the person,Public facilities and services,Streets and squares,Popular Rashid - Golan Street,Ambulance and transfer of a person,Missing,No Clouds,natural,Important,basic,Traffic accident,1,0,,
88,88,58596,81645,Ras Al Khaimah,Civil Defense Center - Al -Jazeera Al -Hamra,Police and traffic,2/12/2013,2013/02/12-06:33,2013/02/12-06:36,2013/02/12-06:37,2/12/2013 6:39,2013/02/12-06:41,2013/02/12-07:30,Transportation accidents,Clash,the person,governmental,Streets and squares,Al -Jazeera Al -Hamra (near the Acacia Hotel),take actions,governmental,No Clouds,natural,very important,basic,Traffic accident,1,0,,
89,89,58606,81655,Ras Al Khaimah,Civil Defense Center - Administration,Civil defense departments and centers,2/13/2013,2013/02/13-20:55,2013/02/13-21:00,2013/02/13-21:02,2/13/2013 21:05,2013/02/13-21:07,2013/02/13-22:00,Transportation accidents,infection,Missing,governmental,unknown,Missing,take actions,furniture,No Clouds,natural,very important,basic,Children tampering,0,0,,
90,90,58616,81665,Ras Al Khaimah,Civil Defense Center - Administration,Police and traffic,2/13/2013,2013/02/13-19:53,2013/02/13-19:59,2013/02/13-20:07,2/13/2013 20:11,2013/02/13-20:22,2013/02/13-20:50,Transportation accidents,Deterioration,Missing,governmental,Streets and squares,Julpar region,take actions,Missing,No Clouds,natural,Important,basic,Traffic accident,5,0,,
91,91,58624,81673,Al Dhafra,Civil Defense Center - Liwa,Police and traffic,2/14/2013,2013/02/14-14:25,2013/02/14-14:50,2013/02/14-14:55,2/14/2013 15:00,2013/02/14-15:05,2013/02/14-15:50,Transportation accidents,One hundredth,the person,Public facilities and services,Streets and squares,"Liwa Road, Zayed City",Ambulance,Cars,No Clouds,natural,Important,basic,Traffic accident,1,0,,
92,92,58625,81674,Umm Al Quwain,Civil Defense Center - Administration,Police and traffic,2/14/2013,2013/02/14-16:30,2013/02/14-16:41,2013/02/14-16:42,2/14/2013 16:43,2013/02/14-16:44,2013/02/14-17:01,Transportation accidents,Deterioration,Cars,Public facilities and services,Public places and places,Al -Abeer Street towards Ras Al Khaimah,Transfer,Cars,No Clouds,natural,Normal,basic,Traffic accident,2,0,,
93,93,58627,81676,Ras Al Khaimah,Civil Defense Center - Administration,Police and traffic,2/14/2013,2013/02/14-20:03,2013/02/14-20:06,2013/02/14-20:09,2/14/2013 20:10,2013/02/14-20:10,2013/02/14-20:50,Transportation accidents,Run over,the person,commercial,Streets and squares,After the bridge roundabout in the Kuwaiti market,Transfer,governmental,No Clouds,natural,Important,basic,Traffic accident,1,0,,
94,94,58629,81678,Ajman,Civil Defense Center - Administration,Police and traffic,2/14/2013,2013/02/14-20:24,2013/02/14-20:27,2013/02/14-20:28,2/14/2013 20:29,2013/02/14-20:30,2013/02/14-21:00,Transportation accidents,Clash,Cars,Means of transport,Streets and squares,The new industrial zone,take actions,Cars,No Clouds,natural,Normal,basic,Traffic accident,2,0,,
95,95,58651,81700,Sharjah,Civil Defense Center - Al Dhaid,Police and traffic,2/16/2013,2013/02/16-18:13,2013/02/16-18:29,2013/02/16-18:31,2/16/2013 18:36,2013/02/16-20:06,2013/02/16-20:35,Transportation accidents,Clash,Cars,governmental,Streets and squares,Maliha Street,take actions,Missing,No Clouds,natural,very important,particle,Traffic accident,1,5,,
96,96,58655,81704,Ras Al Khaimah,Civil Defense Center - Al -Jazeera Al -Hamra,Police and traffic,2/17/2013,2013/02/17-06:14,2013/02/17-06:29,2013/02/17-06:32,2/17/2013 6:34,2013/02/17-06:36,2013/02/17-07:58,Transportation accidents,Clash,the person,governmental,Streets and squares,Near Tuwin roundabout,Ambulance and transfer of a person,Missing,No Clouds,natural,very important,basic,Traffic accident,1,0,,
97,97,58662,81711,Ras Al Khaimah,Civil Defense Center - Al -Jazeera Al -Hamra,Police and traffic,2/17/2013,2013/02/17-18:13,2013/02/17-18:19,2013/02/17-18:21,2/17/2013 18:24,2013/02/17-18:26,2013/02/17-19:02,Transportation accidents,Deterioration,the person,governmental,Streets and squares,Etihad Street,Ambulance and transfer of a person,Missing,No Clouds,natural,Important,basic,Traffic accident,2,0,,
98,98,58669,81718,Ajman,Civil Defense Center - Administration,Police and traffic,2/17/2013,2013/02/17-14:34,2013/02/17-14:36,2013/02/17-14:55,2/17/2013 15:05,2013/02/17-15:10,2013/02/17-15:30,Transportation accidents,Run over,Cars,Public facilities and services,Streets and squares,Al Jarf area,take actions,Missing,No Clouds,natural,very important,basic,Traffic accident,1,0,,
99,99,58672,81721,Ras Al Khaimah,Civil Defense Center - Administration,The audience,2/18/2013,2013/02/18-07:28,2013/02/18-07:33,2013/02/18-07:36,2/18/2013 7:40,2013/02/18-07:40,2013/02/18-08:00,Transportation accidents,Clash,the person,commercial,Commercial market,Khuzam at Ambassador Mall,Transfer,governmental,No Clouds,natural,very important,basic,Traffic accident,1,0,,
100,100,58674,81723,Ras Al Khaimah,Civil Defense Center - Administration,Police and traffic,2/18/2013,2013/02/18-11:17,2013/02/18-11:23,2013/02/18-11:26,2/18/2013 11:27,2013/02/18-11:27,2013/02/18-12:03,Transportation accidents,Clash,the person,Public facilities and services,residential,Golan,Transfer,governmental,No Clouds,natural,Important,basic,Traffic accident,1,0,,
101,101,58676,81725,Abu Dhabi,Civil Defense Center - Shakhbout City,Police and traffic,2/18/2013,2013/02/18-15:38,2013/02/18-15:46,2013/02/18-15:51,2/18/2013 16:30,2013/02/18-16:37,2013/02/18-16:45,Transportation accidents,death,Cars,Public facilities and services,Public places and places,After the Mafraq Bridge towards Abu Dhabi,take actions,Cars,No Clouds,natural,Important,basic,it is not determined yet,0,0,,
102,102,58677,81726,Abu Dhabi,Civil Defense Center - City,Police and traffic,2/18/2013,2013/02/18-08:50,2013/02/18-09:00,2013/02/18-18:30,2/18/2013 18:45,2013/02/18-18:55,2013/02/18-19:10,Transportation accidents,Clash,chemical materials,Public facilities and services,Public places and places,Al -Faya Road,take actions,Cars,No Clouds,natural,very important,basic,it is not determined yet,0,0,,
103,103,58700,81749,Umm Al Quwain,Civil Defense Center - Administration,Police and traffic,2/20/2013,2013/02/20-17:17,2013/02/20-17:26,2013/02/20-17:28,2/20/2013 17:29,2013/02/20-17:30,2013/02/20-18:09,Transportation accidents,Deterioration,Cars,Public facilities and services,Public places and places,Sheikh Mohammed bin Zayed Street between 69 and 103 exit,Transfer,Cars,No Clouds,natural,Normal,basic,Traffic accident,4,0,,
104,104,58701,81750,Umm Al Quwain,Raise Center,Police and traffic,2/20/2013,2013/02/20-18:30,2013/02/20-18:41,2013/02/20-18:42,2/20/2013 18:43,2013/02/20-18:44,2013/02/20-19:15,Transportation accidents,Deterioration,Cars,Public facilities and services,Public places and places,Sheikh Mohammed bin Zayed Street,Ambulance and transfer of a person,Cars,No Clouds,natural,Normal,basic,Traffic accident,1,0,,
105,105,58702,81751,Ajman,Civil Defense Center - Rumaila,Police and traffic,2/16/2013,2013/02/16-00:22,2013/02/16-00:24,2013/02/16-00:25,2/16/2013 0:27,2013/02/16-00:30,2013/02/16-01:05,Transportation accidents,Run over,Cars,Public facilities and services,Public places and places,Near the whale supermarket,take actions,Cars,No Clouds,natural,very important,basic,Traffic accident,1,0,,
106,106,58707,81756,Ras Al Khaimah,Civil Defense Center - Administration,The audience,2/21/2013,2013/02/21-18:19,2013/02/21-18:20,2013/02/21-18:22,2/21/2013 18:24,2013/02/21-18:26,2013/02/21-18:45,Transportation accidents,Clash,the person,governmental,Streets and squares,For contacts,Ambulance and transfer of a person,Missing,No Clouds,natural,very important,basic,Fire extension,2,0,,
107,107,58724,81773,Umm Al Quwain,Raise Center,Police and traffic,2/22/2013,2013/02/22-12:40,2013/02/22-12:51,2013/02/22-12:52,2/22/2013 12:53,2013/02/22-13:20,2013/02/22-13:55,Transportation accidents,One hundredth,the person,Other places,Streets and squares,Sheikh Mohammed bin Zayed Street near the exit 110,Transfer,Missing,No Clouds,natural,Normal,basic,Traffic accident,1,0,,
108,108,58725,81774,Eye,Civil Defense Center - Zakher (fast intervention),Police and traffic,2/22/2013,2013/02/22-17:18,2013/02/22-17:37,2013/02/22-17:58,2/22/2013 18:15,2013/02/22-19:05,2013/02/22-19:25,Transportation accidents,Clash,Cars,Means of transport,car,Jabal Hafit Road,take actions,Cars,No Clouds,natural,very important,medium,Traffic accident,4,1,,
109,109,58731,81780,Ras Al Khaimah,Civil Defense Center - Al -Jazeera Al -Hamra,Police and traffic,2/22/2013,2013/02/22-23:44,2013/02/22-23:46,2013/02/22-23:56,2/23/2013 0:27,2013/02/23-00:28,2013/02/23-01:20,Transportation accidents,Run over,the person,tourist,Methods and transport facilities,Al -Jazeera Al -Hamra near the Akassia Hotel,Bodies,governmental,No Clouds,natural,very important,medium,Traffic accident,0,1,,
110,110,58740,81789,Al Dhafra,Civil Defense Center - Port,Police and traffic,2/23/2013,2013/02/23-23:15,2013/02/23-23:20,2013/02/23-23:21,2/23/2013 23:22,2013/02/23-23:24,2013/02/23-23:45,Transportation accidents,Run over,the person,Public facilities and services,Public places and places,An accident run over the city of the interstate near the association,Ambulance and transfer of a person,Cars,No Clouds,natural,very important,basic,Traffic accident,1,0,,
111,111,58741,81790,Ras Al Khaimah,Civil Defense Center - Administration,The audience,2/24/2013,2013/02/24-23:01,2013/02/24-23:03,2013/02/24-23:05,2/24/2013 23:07,2013/02/24-23:20,2013/02/24-23:25,Transportation accidents,Deterioration,the person,Public facilities and services,Streets and squares,Crimea Street - Al Nakheel,Ambulance and transfer of a person,Missing,No Clouds,natural,Normal,basic,it is not determined yet,1,0,,
112,112,58764,81813,Al Dhafra,Civil Defense Center - Port,Police and traffic,2/25/2013,2013/02/25-20:40,2013/02/25-20:50,2013/02/25-20:55,2/25/2013 20:56,2013/02/25-20:57,2013/02/25-21:10,Transportation accidents,Deterioration,the person,Public facilities and services,Public places and places,"Linter deterioration accident, public street",Ambulance and transfer of a person,Cars,No Clouds,natural,Important,basic,Traffic accident,1,0,,
113,113,58767,81816,Ajman,Civil Defense Center - Administration,Other parties,2/25/2013,2013/02/25-07:03,2013/02/25-07:07,2013/02/25-07:09,2/26/2013 7:11,2013/02/26-07:15,2013/02/26-08:30,Transportation accidents,Clash,Cars,governmental,Streets and squares,Aquarium Pink No. 21,Fire fighting and infected with an injured,Missing,No Clouds,natural,Normal,basic,Traffic accident,1,0,,
114,114,58776,81825,Ras Al Khaimah,Civil Defense Center - Administration,Police and traffic,2/26/2013,2013/02/26-09:41,2013/02/26-09:43,2013/02/26-09:47,2/26/2013 9:50,2013/02/26-09:51,2013/02/26-10:30,Transportation accidents,Clash,the person,commercial,unknown,"After the Ras Al Khaimah Bridge, the Burj Al Arab place came back",Transfer,governmental,No Clouds,natural,Important,basic,Traffic accident,1,0,,
115,115,58777,81826,Ras Al Khaimah,Civil Defense Center - Administration,Police and traffic,2/26/2013,2013/02/26-12:34,2013/02/26-12:35,2013/02/26-12:38,2/26/2013 12:39,2013/02/26-12:39,2013/02/26-13:11,Transportation accidents,Deterioration,the person,Public facilities and services,Methods and transport facilities,"Ali Ras Al -Khaimah Bridge, in the face of palm trees",Transfer,governmental,No Clouds,natural,very important,basic,Traffic accident,1,0,,
116,116,58778,81827,Ras Al Khaimah,Civil Defense Center - Administration,Police and traffic,2/26/2013,2013/02/26-14:05,2013/02/26-14:09,2013/02/26-14:11,2/26/2013 14:15,2013/02/26-14:18,2013/02/26-14:44,Transportation accidents,Clash,the person,commercial,Commercial market,Ras Al Khaimah at Ras Al Khaimah Bank,Transfer,governmental,No Clouds,natural,Important,basic,Traffic accident,2,0,,
117,117,58781,81830,Ras Al Khaimah,Civil Defense Center - Administration,Police and traffic,2/26/2013,2013/02/26-17:05,2013/02/26-17:11,2013/02/26-17:14,2/26/2013 17:15,2013/02/26-17:15,2013/02/26-18:00,Transportation accidents,Deterioration,the person,governmental,unknown,"Sheikh Mohammed bin Zayed Street, in the face of Saadi",Transfer,governmental,No Clouds,natural,very important,basic,Traffic accident,1,0,,
118,118,58794,81843,Ajman,Civil Defense Center - Administration,The audience,2/27/2013,2013/02/27-07:56,2013/02/27-08:00,2013/02/27-08:05,2/27/2013 8:10,2013/02/27-08:15,2013/02/27-09:00,Transportation accidents,Clash,Cars,Industrial,Streets and squares,Al Jarf area,Exit and transfer injured people,Missing,No Clouds,natural,Normal,basic,Traffic accident,5,0,,
119,119,58796,81845,Ras Al Khaimah,Civil Defense Center - Administration,Police and traffic,2/27/2013,2013/02/27-13:53,2013/02/27-13:58,2013/02/27-14:00,2/27/2013 14:02,2013/02/27-14:25,2013/02/27-14:35,Transportation accidents,Clash,the person,Public facilities and services,Streets and squares,Al -Mairid - near Quba School,Ambulance and transfer of a person,Missing,No Clouds,natural,Normal,basic,Traffic accident,1,0,,
120,120,58801,81850,Al Dhafra,Civil Defense Center - Ghayathi,Police and traffic,2/27/2013,2013/02/27-20:05,2013/02/27-20:12,2013/02/27-20:13,2/27/2013 20:14,2013/02/27-20:15,2013/02/27-20:25,Transportation accidents,Clash,Cars,Public facilities and services,Public places and places,Two Ghayathi cars collision near industrial,Ambulance and transfer of a person,Cars,No Clouds,natural,Important,basic,Traffic accident,1,0,,
121,121,58814,81863,Fujairah,Civil Defense Center - Dibba,Police and traffic,2/28/2013,2013/02/28-11:15,2013/02/28-11:21,2013/02/28-11:23,2/28/2013 11:25,2013/02/28-11:30,2013/02/28-11:40,Transportation accidents,Clash,Cars,governmental,unknown,Roll Dibba area,Ambulance,Missing,No Clouds,natural,very important,basic,Traffic accident,3,0,,
122,122,58816,81865,Fujairah,Civil Defense Center - Dibba,Police and traffic,2/28/2013,2013/02/28-11:59,2013/02/28-12:05,2013/02/28-12:07,2/28/2013 12:09,2013/02/28-12:14,2013/02/28-12:22,Transportation accidents,Clash,Cars,governmental,unknown,Roll Dibba area,Ambulance,Missing,No Clouds,natural,very important,basic,Children tampering,2,0,,
123,123,58823,81872,Ajman,Civil Defense Center - Administration,Police and traffic,3/1/2013,2013/03/01-02:26,2013/03/01-02:30,2013/03/01-02:31,3/1/2013 2:33,2013/03/01-03:15,2013/03/01-03:45,Transportation accidents,Clash,Missing,governmental,Streets and squares,Sheikh Mohammed bin Zayed Street,Ambulance and rescue,Missing,No Clouds,natural,Important,medium,Traffic accident,3,1,,
124,124,58826,81875,Umm Al Quwain,Civil Defense Center - Administration,Police and traffic,3/1/2013,2013/03/01-00:02,2013/03/01-00:04,2013/03/01-00:05,3/1/2013 0:07,2013/03/01-00:08,2013/03/01-00:50,Transportation accidents,Deterioration,bike,Public facilities and services,Public places and places,Horse roundabout Al -Salamah area,Ambulance and transfer of a person,furniture,No Clouds,natural,Normal,basic,Traffic accident,1,0,,
125,125,58829,81878,Ras Al Khaimah,Civil Defense Center - Kadra,Police and traffic,3/1/2013,2013/03/01-14:12,2013/03/01-14:26,2013/03/01-14:30,3/1/2013 14:35,2013/03/01-14:38,2013/03/01-15:45,Transportation accidents,Deterioration,the person,governmental,bike,Al -Munaii Street,Ambulance and transfer of a person,Missing,No Clouds,natural,Important,basic,Traffic accident,2,0,,
126,126,58849,81898,Ras Al Khaimah,Civil Defense Center - Administration,Police and traffic,3/2/2013,2013/03/02-17:25,2013/03/02-17:30,2013/03/02-17:32,3/2/2013 17:33,2013/03/02-17:34,2013/03/02-18:00,Transportation accidents,Clash,the person,residential,Commercial market,Konish Al -Qawasim at Khayat Al -Arabi Al -Mumtaz,Transfer,governmental,No Clouds,natural,Important,basic,Traffic accident,1,0,,
127,127,58852,81901,Ras Al Khaimah,Civil Defense Center - Administration,The audience,3/2/2013,2013/03/02-18:15,2013/03/02-18:18,2013/03/02-18:21,3/2/2013 18:23,2013/03/02-18:23,2013/03/02-18:50,Transportation accidents,Clash,the person,commercial,unknown,Al -Montaser Street opposite the Emirates Islamic Bank,Transfer,governmental,No Clouds,natural,Important,basic,Traffic accident,1,0,,
128,128,58865,81914,Ras Al Khaimah,Civil Defense Center - Administration,Police and traffic,3/3/2013,2013/03/03-14:48,2013/03/03-14:52,2013/03/03-15:00,3/3/2013 15:06,2013/03/03-15:13,2013/03/03-15:19,Transportation accidents,a fire,Missing,governmental,unknown,Missing,take actions,furniture,No Clouds,natural,very important,basic,it is not determined yet,0,0,,
129,129,58868,81917,Ras Al Khaimah,Civil Defense Center - Administration,Police and traffic,3/3/2013,2013/03/03-21:20,2013/03/03-21:24,2013/03/03-21:26,3/3/2013 21:28,2013/03/03-21:50,2013/03/03-22:00,Transportation accidents,Clash,the person,governmental,Streets and squares,Golan-,Ambulance and transfer of a person,Missing,No Clouds,natural,Normal,basic,Traffic accident,1,0,,
130,130,58907,81956,Ras Al Khaimah,Civil Defense Center - Administration,Police and traffic,3/6/2013,2013/03/06-17:50,2013/03/06-17:53,2013/03/06-17:55,3/6/2013 18:00,2013/03/06-18:04,2013/03/06-18:10,Transportation accidents,Clash,the person,commercial,Commercial market,Palm intersection,Transfer,governmental,No Clouds,natural,Important,basic,Traffic accident,1,0,,
131,131,58914,81963,Ras Al Khaimah,Civil Defense Center - Administration,The audience,3/7/2013,2013/03/07-09:37,2013/03/07-09:40,2013/03/07-09:43,3/7/2013 9:45,2013/03/07-09:47,2013/03/07-10:25,Transportation accidents,Deterioration,the person,governmental,Streets and squares,Al -Sih area,Ambulance and transfer of a person,Missing,No Clouds,natural,very important,basic,Traffic accident,1,0,,
132,132,58915,81964,Ras Al Khaimah,Civil Defense Center - Administration,Police and traffic,3/7/2013,2013/03/07-12:16,2013/03/07-12:26,2013/03/07-12:28,3/7/2013 12:31,2013/03/07-12:33,2013/03/07-13:35,Transportation accidents,Clash,the person,governmental,Streets and squares,Shama Al Rams Street,Ambulance and transfer of a person,Missing,No Clouds,natural,very important,basic,Traffic accident,3,0,,
133,133,58919,81968,Ras Al Khaimah,Civil Defense Center - Administration,Police and traffic,3/7/2013,2013/03/07-16:18,2013/03/07-16:20,2013/03/07-16:25,3/7/2013 16:35,2013/03/07-16:45,2013/03/07-16:55,Transportation accidents,Clash,the person,Public facilities and services,Streets and squares,Palm - opposite Ambassador Market,Ambulance and transfer of a person,Missing,No Clouds,natural,Normal,basic,Traffic accident,4,0,,
134,134,58923,81972,Fujairah,Civil Defense Center - Administration,Police and traffic,3/7/2013,2013/03/07-12:05,2013/03/07-12:11,2013/03/07-12:14,3/7/2013 12:15,2013/03/07-12:16,2013/03/07-12:30,Transportation accidents,Deterioration,Missing,Public facilities and services,Streets and squares,Roll - Dibba Fujairah,Transfer,Missing,I did not specify,natural,Normal,basic,Children tampering,1,0,,
135,135,58929,81978,Umm Al Quwain,Civil Defense Center - Al -Madinah,Civil defense departments and centers,3/8/2013,2013/03/08-05:25,2013/03/08-05:29,2013/03/08-05:30,3/8/2013 5:31,2013/03/08-05:32,2013/03/08-05:50,Transportation accidents,Deterioration,Cars,Public facilities and services,Public places and places,Near the Sheikh Zayed Mosque,Ambulance and transfer of a person,Cars,No Clouds,natural,Normal,basic,Traffic accident,1,0,,
136,136,58952,82001,Ras Al Khaimah,Civil Defense Center - Northern Administration,Police and traffic,3/9/2013,2013/03/09-06:49,2013/03/09-06:56,2013/03/09-06:57,3/9/2013 7:01,2013/03/09-07:08,2013/03/09-07:48,Transportation accidents,Deterioration,the person,governmental,Streets and squares,Durakorkhoire towards Shahm,Ambulance and transfer of injured and deceased,Missing,No Clouds,natural,very important,medium,Traffic accident,2,1,,
137,137,58957,82006,Ajman,Civil Defense Center - Administration,Police and traffic,3/9/2013,2013/03/09-15:59,2013/03/09-16:03,2013/03/09-16:09,3/9/2013 16:10,2013/03/09-16:21,2013/03/09-16:30,Transportation accidents,infection,Missing,Other places,Streets and squares,Industrial near Nissan Agency,Ambulance and transfer of a person,Missing,No Clouds,natural,Normal,basic,Traffic accident,1,0,,
138,138,58967,82016,Al Dhafra,Civil Defense Center - Liwa,Police and traffic,3/10/2013,2013/03/10-12:00,2013/03/10-12:10,2013/03/10-12:15,3/10/2013 12:16,2013/03/10-12:20,2013/03/10-12:30,Transportation accidents,Deterioration,tank,Public facilities and services,Public places and places,"August the sewers denying in Liwa, intimate direction",Ambulance and transfer of a person,Cars,No Clouds,natural,Important,basic,Traffic accident,1,0,,
139,139,58970,82019,Ras Al Khaimah,Civil Defense Center - Administration,Police and traffic,3/10/2013,2013/03/10-16:51,2013/03/10-16:52,2013/03/10-16:54,3/10/2013 16:54,2013/03/10-16:56,2013/03/10-17:20,Transportation accidents,Clash,the person,Public facilities and services,Streets and squares,Al -Hosn Street before the ADNOC oil station,Ambulance and transfer of a person,Missing,No Clouds,natural,Important,basic,Traffic accident,1,0,,
140,140,58972,82021,Ras Al Khaimah,Civil Defense Center - Administration,Police and traffic,3/10/2013,2013/03/10-19:50,2013/03/10-19:52,2013/03/10-19:55,3/10/2013 19:56,2013/03/10-19:56,2013/03/10-20:20,Transportation accidents,Clash,the person,Public facilities and services,Commercial market,Al -Jazza Street opposite Ras Al Khaimah Insurance Company,Transfer,commercial,No Clouds,natural,Important,basic,Traffic accident,2,0,,
141,141,58973,82022,Ras Al Khaimah,Civil Defense Center - Administration,Police and traffic,3/10/2013,2013/03/10-20:40,2013/03/10-20:43,2013/03/10-20:45,3/10/2013 20:47,2013/03/10-20:50,2013/03/10-21:28,Transportation accidents,Clash,the person,commercial,Shopping center,Expo Center for the main gate,Transfer,governmental,No Clouds,natural,very important,basic,Traffic accident,3,0,,
142,142,58975,82024,Ajman,Civil Defense Center - Administration,Police and traffic,3/10/2013,2013/03/10-13:29,2013/03/10-13:36,2013/03/10-13:37,3/10/2013 13:38,2013/03/10-13:40,2013/03/10-14:15,Transportation accidents,Clash,the person,Public facilities and services,Public places and places,Al -Tal area / Sheikh Mohammed bin Zayed Street,take actions,Cars,No Clouds,natural,Normal,basic,Traffic accident,1,0,,
143,143,58983,82032,Ras Al Khaimah,Civil Defense Center - Administration,Police and traffic,3/11/2013,2013/03/11-10:55,2013/03/11-10:56,2013/03/11-11:00,3/11/2013 11:02,2013/03/11-11:09,2013/03/11-11:46,Transportation accidents,Run over,the person,governmental,Streets and squares,Halila Street,take actions,Missing,No Clouds,natural,Important,basic,Traffic accident,1,0,,
144,144,58989,82038,Ras Al Khaimah,Civil Defense Center - Administration,Police and traffic,3/11/2013,2013/03/11-22:49,2013/03/11-22:52,2013/03/11-22:54,3/11/2013 22:56,2013/03/11-22:58,2013/03/11-23:14,Transportation accidents,Clash,the person,governmental,Streets and squares,The sacrifice area,take actions,Missing,No Clouds,natural,Important,basic,Traffic accident,1,0,,
145,145,58995,82044,Al Dhafra,Civil Defense Center - Port,Police and traffic,3/12/2013,2013/03/12-11:47,2013/03/12-11:57,2013/03/12-11:58,3/12/2013 11:59,2013/03/12-12:00,2013/03/12-12:20,Transportation accidents,Deterioration,Cars,Public facilities and services,Public places and places,A deterioration accident by the farmer of the city of the city,Ambulance and transfer of a person,Cars,No Clouds,natural,Important,basic,Traffic accident,1,0,,
146,146,59001,82050,Umm Al Quwain,Raise Center,Police and traffic,3/12/2013,2013/03/12-17:58,2013/03/12-18:10,2013/03/12-18:20,3/12/2013 18:25,2013/03/12-18:35,2013/03/12-18:43,Transportation accidents,Clash,the person,Other places,unknown,"Sheikh Mohammed bin Zayed Street, director of Dream Land, towards Amar",Transfer,Cars,No Clouds,natural,Normal,basic,Traffic accident,1,0,,
147,147,59013,82062,Al Dhafra,Civil Defense Center - Port,Police and traffic,3/13/2013,2013/03/13-17:50,2013/03/13-18:07,2013/03/13-18:10,3/13/2013 18:11,2013/03/13-18:12,2013/03/13-18:55,Transportation accidents,Clash,Cars,Public facilities and services,Public places and places,Bus and truck collision before Al -Hahwaniya towards commodities,take actions,Cars,No Clouds,natural,Important,basic,Traffic accident,6,0,,
148,148,59021,82070,Ras Al Khaimah,Civil Defense Center - Administration,Police and traffic,3/14/2013,2013/03/14-13:45,2013/03/14-13:50,2013/03/14-13:52,3/14/2013 13:53,2013/03/14-13:54,2013/03/14-14:28,Transportation accidents,Clash,the person,commercial,Commercial market,Palm in front of the Shuweram supermarket,Transfer,Cooperative,No Clouds,natural,very important,basic,Traffic accident,1,0,,
149,149,59023,82072,Fujairah,Civil Defense Center - Administration,Police and traffic,3/14/2013,2013/03/14-13:30,2013/03/14-13:35,2013/03/14-13:36,3/14/2013 13:37,2013/03/14-13:45,2013/03/14-13:50,Transportation accidents,Clash,Cars,Public facilities and services,Streets and squares,Fujairah Port Street,Ambulance and rescue,Missing,No Clouds,natural,Normal,basic,Traffic accident,1,0,,
150,150,59028,82077,Al Dhafra,Civil Defense Center - Zayed City,Police and traffic,3/14/2013,2013/03/14-19:59,2013/03/14-20:20,2013/03/14-20:45,3/14/2013 20:46,2013/03/14-20:50,2013/03/14-22:15,Transportation accidents,Clash,Cars,Public facilities and services,Public places and places,14 passengers collision and Station of Habshan area,Directing confined and transferring injured people,Cars,No Clouds,natural,Important,medium,Traffic accident,11,0,,
151,151,59030,82079,Al Dhafra,Civil Defense Center - Port,Police and traffic,3/14/2013,2013/03/14-22:10,2013/03/14-22:15,2013/03/14-22:20,3/14/2013 22:21,2013/03/14-22:22,2013/03/14-22:55,Transportation accidents,Clash,Cars,Public facilities and services,Public places and places,The public street opposite the mosque of the city of the port,Ambulance and rescue,Cars,No Clouds,natural,Important,basic,Traffic accident,3,0,,
152,152,59045,82094,Ras Al Khaimah,Civil Defense Center - Administration,Civil defense departments and centers,3/15/2013,2013/03/15-17:48,2013/03/15-17:50,2013/03/15-17:53,3/15/2013 17:56,2013/03/15-18:00,2013/03/15-18:12,Transportation accidents,Clash,Missing,governmental,unknown,Missing,take actions,Missing,No Clouds,natural,very important,basic,Unknown,1,0,,
153,153,59050,82099,Al Dhafra,Civil Defense Center - Ghayathi,Police and traffic,3/15/2013,2013/03/15-21:21,2013/03/15-21:29,2013/03/15-21:34,3/15/2013 21:35,2013/03/15-21:36,2013/03/15-22:10,Transportation accidents,Deterioration,Cars,Public facilities and services,Public places and places,"Giathi Ruwais Road, near Ghiathi Industrial",Ambulance and transfer of a person,Cars,No Clouds,natural,Important,basic,Traffic accident,9,0,,
154,154,59056,82105,Umm Al Quwain,Raise Center,Civil defense departments and centers,3/16/2013,2013/03/16-07:05,2013/03/16-07:12,2013/03/16-07:13,3/16/2013 7:14,2013/03/16-07:15,2013/03/16-07:36,Transportation accidents,Deterioration,Cars,Public facilities and services,Public places and places,Sheikh Mohammed bin Zayed Street towards Ras Al Khaimah,Transfer,Cars,No Clouds,natural,Normal,basic,Traffic accident,2,0,,
155,155,59086,82135,Ajman,Civil Defense Center - Administration,Police and traffic,3/18/2013,2013/03/18-12:10,2013/03/18-12:15,2013/03/18-12:16,3/18/2013 12:17,2013/03/18-12:33,2013/03/18-12:40,Transportation accidents,One hundredth,Missing,Other places,Streets and squares,Mashirf commercial area? Against the luxury tobacco factory th,Transfer,Missing,No Clouds,natural,Normal,basic,Traffic accident,1,0,,
156,156,59104,82155,Ras Al Khaimah,Civil Defense Center - Al -Jazeera Al -Hamra,Police and traffic,3/19/2013,2013/03/19-14:18,2013/03/19-14:20,2013/03/19-14:24,3/19/2013 14:30,2013/03/19-14:48,2013/03/19-15:04,Transportation accidents,Clash,the person,Public facilities and services,Streets and squares,Mohammed bin Zayed Street - Exit 119,Ambulance and transfer of a person,Missing,No Clouds,natural,Normal,basic,Traffic accident,2,0,,
157,157,59105,82156,Ras Al Khaimah,Civil Defense Center - Administration,Police and traffic,3/19/2013,2013/03/19-15:30,2013/03/19-15:33,2013/03/19-15:39,3/19/2013 15:40,2013/03/19-15:45,2013/03/19-16:00,Transportation accidents,Clash,the person,Public facilities and services,Streets and squares,Palm,Ambulance and transfer of a person,Missing,No Clouds,natural,Normal,basic,Traffic accident,2,0,,
158,158,59107,82158,Ras Al Khaimah,Civil Defense Center - Northern Administration,Civil defense departments and centers,3/19/2013,2013/03/19-19:38,2013/03/19-19:43,2013/03/19-19:45,3/19/2013 19:47,2013/03/19-20:02,2013/03/19-20:35,Transportation accidents,Deterioration,the person,governmental,unknown,Saqr Port,take actions,furniture,No Clouds,natural,Important,basic,Traffic accident,3,0,,
159,159,59108,82159,Ras Al Khaimah,Civil Defense Center - Administration,Police and traffic,3/19/2013,2013/03/19-22:40,2013/03/19-22:42,2013/03/19-22:55,3/19/2013 23:22,2013/03/19-23:33,2013/03/19-23:37,Transportation accidents,a fire,Cars,governmental,unknown,Al -Kharan Street,take actions,Missing,No Clouds,natural,Important,basic,Traffic accident,0,0,,
160,160,59112,82163,Ajman,Civil Defense Center - Administration,Police and traffic,3/20/2013,2013/03/20-11:40,2013/03/20-11:45,2013/03/20-11:50,3/20/2013 11:55,2013/03/20-12:00,2013/03/20-12:25,Transportation accidents,Clash,the person,Means of transport,Streets and squares,industrial area ? For Hamdan Center,Ambulance and transfer of a person,Missing,No Clouds,natural,Normal,basic,it is not determined yet,0,0,,
161,161,59113,82164,Umm Al Quwain,Civil Defense Center - Administration,Police and traffic,3/20/2013,2013/03/20-15:48,2013/03/20-15:51,2013/03/20-15:52,3/20/2013 15:53,2013/03/20-15:55,2013/03/20-16:15,Transportation accidents,Deterioration,the person,governmental,Streets and squares,Al -Ittihad Street - Al -Ittihad roundabout,Ambulance and transfer of a person,Cars,No Clouds,natural,Normal,basic,Traffic accident,1,0,,
162,162,59114,82165,Umm Al Quwain,Civil Defense Center - Administration,Police and traffic,3/20/2013,2013/03/20-16:08,2013/03/20-16:17,2013/03/20-16:18,3/20/2013 16:19,2013/03/20-16:20,2013/03/20-16:40,Transportation accidents,Clash,the person,Public facilities and services,Streets and squares,Al -Abeer Street near the transit bridge,Ambulance and transfer of a person,Cars,No Clouds,natural,Normal,basic,Traffic accident,1,0,,
163,163,59128,82179,Ras Al Khaimah,Civil Defense Center - Kadra,Police and traffic,3/21/2013,2013/03/21-09:25,2013/03/21-09:30,2013/03/21-09:32,3/21/2013 9:35,2013/03/21-09:40,2013/03/21-09:48,Transportation accidents,Clash,Cars,governmental,Streets and squares,Thorn,Ambulance and rescue,Missing,No Clouds,natural,Important,basic,Traffic accident,0,0,,
164,164,59132,82183,Ras Al Khaimah,Civil Defense Center - Administration,Police and traffic,3/21/2013,2013/03/21-17:24,2013/03/21-17:27,2013/03/21-17:30,3/21/2013 17:35,2013/03/21-17:37,2013/03/21-17:55,Transportation accidents,Clash,the person,governmental,Streets and squares,Al Mamoura area,Ambulance,Missing,No Clouds,natural,Important,basic,Traffic accident,1,0,,
165,165,59133,82184,Ras Al Khaimah,Civil Defense Center - Administration,Police and traffic,3/21/2013,2013/03/21-19:01,2013/03/21-19:05,2013/03/21-19:06,3/21/2013 19:10,2013/03/21-19:14,2013/03/21-19:30,Transportation accidents,Clash,the person,governmental,Streets and squares,Al -Mairid area,Ambulance and transfer of a person,Missing,No Clouds,natural,Important,basic,Traffic accident,1,0,,
166,166,59137,82188,Ras Al Khaimah,Civil Defense Center - Administration,Police and traffic,3/21/2013,2013/03/21-21:39,2013/03/21-21:43,2013/03/21-21:45,3/21/2013 21:47,2013/03/21-21:50,2013/03/21-22:35,Transportation accidents,Run over,the person,governmental,Streets and squares,Julpar Street towards the whispering,Ambulance and transfer of a person,Missing,No Clouds,natural,Important,basic,Traffic accident,1,0,,
167,167,59140,82191,Ras Al Khaimah,Civil Defense Center - Administration,Police and traffic,3/21/2013,2013/03/21-23:03,2013/03/21-23:06,2013/03/21-23:08,3/21/2013 23:10,2013/03/21-23:12,2013/03/22-00:18,Transportation accidents,Run over,the person,governmental,Streets and squares,Dahan area,Ambulance and transfer of a person,Missing,No Clouds,natural,Important,basic,Traffic accident,1,0,,
168,168,59142,82193,Ras Al Khaimah,Civil Defense Center - Administration,Police and traffic,3/22/2013,2013/03/22-01:36,2013/03/22-01:40,2013/03/22-01:42,3/22/2013 1:45,2013/03/22-01:47,2013/03/22-02:18,Transportation accidents,Run over,the person,governmental,Streets and squares,Crimea Street opposite the Capital Hotel,Ambulance and transfer of a person,Missing,No Clouds,natural,Important,basic,Traffic accident,1,0,,
169,169,59145,82196,Umm Al Quwain,Civil Defense Center - Administration,Police and traffic,3/22/2013,2013/03/22-07:55,2013/03/22-08:06,2013/03/22-08:08,3/22/2013 8:10,2013/03/22-08:11,2013/03/22-08:37,Transportation accidents,Deterioration,Cars,Public facilities and services,Public places and places,Al -Abeer Street towards Sharjah near a polite bridge,Exit and transfer injured people,Cars,No Clouds,natural,Normal,basic,Traffic accident,5,0,,
170,170,59146,82197,Ras Al Khaimah,Civil Defense Center - Al -Jazeera Al -Hamra,Police and traffic,3/22/2013,2013/03/22-13:37,2013/03/22-13:42,2013/03/22-13:45,3/22/2013 13:50,2013/03/22-13:55,2013/03/22-14:35,Transportation accidents,Clash,the person,residential,Streets and squares,Riffa opposite the Arab port,Directing confined and transferring injured people,governmental,No Clouds,natural,very important,basic,Traffic accident,2,0,,
171,171,59149,82200,Ras Al Khaimah,Civil Defense Center - Administration,Police and traffic,3/22/2013,2013/03/22-16:49,2013/03/22-16:58,2013/03/22-18:02,3/22/2013 18:03,2013/03/22-18:05,2013/03/22-18:20,Transportation accidents,Clash,the person,residential,residential,Reduce behind the Cooperation Club,Transfer,governmental,No Clouds,natural,Important,basic,Traffic accident,1,0,,
172,172,59154,82205,Ras Al Khaimah,Civil Defense Center - Administration,Police and traffic,3/22/2013,2013/03/22-22:28,2013/03/22-22:35,2013/03/22-22:40,3/22/2013 22:45,2013/03/22-22:50,2013/03/22-23:00,Transportation accidents,Clash,the person,residential,Shopping center,Julpar opposite the Gulf markets,Transfer,governmental,No Clouds,natural,very important,basic,Traffic accident,3,0,,
173,173,59158,82209,Fujairah,Civil Defense Center - Administration,Military officers and members,3/22/2013,2013/03/22-20:59,2013/03/22-21:03,2013/03/22-21:05,3/22/2013 21:06,2013/03/22-21:07,2013/03/22-21:18,Transportation accidents,Run over,Missing,Public facilities and services,Streets and squares,Market - Dibba Fujairah,Ambulance and rescue,Missing,I did not specify,natural,Important,basic,Traffic accident,1,0,,
174,174,59177,82228,Al Dhafra,Civil Defense Center - Port,Police and traffic,3/24/2013,2013/03/24-15:35,2013/03/24-15:47,2013/03/24-15:49,3/24/2013 15:50,2013/03/24-15:51,2013/03/24-16:10,Transportation accidents,Deterioration,Cars,Public facilities and services,Public places and places,Blinding public street,Ambulance and transfer of a person,Cars,No Clouds,natural,Important,basic,Traffic accident,1,0,,
175,175,59179,82230,Ajman,Civil Defense Center - Administration,Police and traffic,3/24/2013,2013/03/24-16:22,2013/03/24-16:25,2013/03/24-16:27,3/24/2013 16:30,2013/03/24-16:45,2013/03/24-16:50,Transportation accidents,Restriction,Missing,Other places,Streets and squares,Industrial area near the Nissan Motor Agency workshop,Disturbing injured,Missing,No Clouds,natural,Normal,basic,Maafal/deliberate/by an actor,1,0,,
176,176,59181,82232,Fujairah,Civil Defense Center - Dibba,Police and traffic,3/24/2013,2013/03/24-11:35,2013/03/24-11:39,2013/03/24-11:40,3/24/2013 11:41,2013/03/24-11:41,2013/03/24-11:46,Transportation accidents,Run over,Missing,governmental,unknown,Sill,Ambulance,Missing,No Clouds,natural,very important,basic,Unknown,0,0,,
177,177,59185,82236,Ras Al Khaimah,Civil Defense Center - Al -Jazeera Al -Hamra,Police and traffic,3/25/2013,2013/03/25-10:10,2013/03/25-10:18,2013/03/25-10:20,3/25/2013 10:35,2013/03/25-10:37,2013/03/25-10:59,Transportation accidents,Clash,the person,governmental,Streets and squares,Southern Al -Dhait towards Al -Ittihad University,Ambulance and transfer of a person,Specific,No Clouds,natural,Important,basic,Traffic accident,1,0,,
178,178,59191,82242,Ras Al Khaimah,Civil Defense Center - Administration,Police and traffic,3/25/2013,2013/03/25-15:04,2013/03/25-15:08,2013/03/25-15:10,3/25/2013 15:25,2013/03/25-15:27,2013/03/25-15:48,Transportation accidents,Clash,the person,governmental,Streets and squares,Al -Shraisha area opposite the ADNOC oil station,Ambulance and transfer of a person,Specific,No Clouds,natural,Important,basic,Traffic accident,3,0,,
179,179,59192,82243,Ras Al Khaimah,Civil Defense Center - Administration,Police and traffic,3/25/2013,2013/03/25-15:35,2013/03/25-15:37,2013/03/25-15:39,3/25/2013 15:41,2013/03/25-15:42,2013/03/25-16:10,Transportation accidents,Clash,the person,governmental,Streets and squares,Palm intersection Al -Manar Center,Ambulance and transfer of a person,Specific,No Clouds,natural,Important,basic,Traffic accident,1,0,,
180,180,59195,82246,Umm Al Quwain,Raise Center,Police and traffic,3/25/2013,2013/03/25-19:42,2013/03/25-19:51,2013/03/25-19:53,3/25/2013 19:54,2013/03/25-19:55,2013/03/25-21:00,Transportation accidents,One hundredth,Cars,Public facilities and services,Streets and squares,Sheikh Mohammed bin Zayed Street near Exit No. (110),take actions,Cars,No Clouds,natural,Normal,basic,Traffic accident,1,0,,
181,181,59200,82251,Ras Al Khaimah,Civil Defense Center - Administration,Police and traffic,3/25/2013,2013/03/25-19:59,2013/03/25-20:02,2013/03/25-20:05,3/25/2013 20:35,2013/03/25-20:38,2013/03/25-21:00,Transportation accidents,Clash,the person,governmental,Streets and squares,Al -Mairid area,Ambulance and transfer of a person,Specific,No Clouds,natural,very important,basic,Traffic accident,2,0,,
182,182,59207,82258,Ras Al Khaimah,Civil Defense Center - Administration,Police and traffic,3/26/2013,2013/03/26-14:26,2013/03/26-14:31,2013/03/26-14:35,3/26/2013 14:37,2013/03/26-14:38,2013/03/26-15:20,Transportation accidents,Deterioration,the person,Public facilities and services,residential,Al -Rams is an area on the main street,Transfer,governmental,No Clouds,natural,very important,basic,Traffic accident,2,0,,
183,183,59212,82263,Ras Al Khaimah,Civil Defense Center - Administration,Police and traffic,3/26/2013,2013/03/26-21:10,2013/03/26-21:15,2013/03/26-21:17,3/26/2013 21:20,2013/03/26-21:22,2013/03/26-22:10,Transportation accidents,One hundredth,the person,residential,residential,Golan Veterinary Street,Transfer,governmental,No Clouds,natural,very important,basic,Traffic accident,1,0,,
184,184,59240,82291,Umm Al Quwain,Civil Defense Center - Administration,Police and traffic,3/29/2013,2013/03/29-05:35,2013/03/29-05:39,2013/03/29-05:40,3/29/2013 5:42,2013/03/29-05:43,2013/03/29-06:15,Transportation accidents,Deterioration,Cars,Public facilities and services,Public places and places,El-Shikh Zayed street,Exit and transfer injured people,Cars,No Clouds,natural,Normal,basic,Children tampering,2,0,,
185,185,59243,82294,Ras Al Khaimah,Civil Defense Center - Northern Administration,Police and traffic,3/28/2013,2013/03/28-23:55,2013/03/28-23:59,2013/03/29-00:02,3/29/2013 0:05,2013/03/29-00:50,2013/03/29-00:53,Transportation accidents,Deterioration,the person,governmental,Streets and squares,Khurkheir (Salad),Ambulance and transfer of a person,Specific,No Clouds,natural,Important,basic,Traffic accident,1,0,,
186,186,59245,82296,Ras Al Khaimah,Civil Defense Center - Northern Administration,Police and traffic,3/29/2013,2013/03/29-10:21,2013/03/29-10:27,2013/03/29-10:29,3/29/2013 10:32,2013/03/29-10:35,2013/03/29-11:21,Transportation accidents,Run over,the person,governmental,Streets and squares,Khorghawear opposite the port of Saqr,Ambulance and transfer of a person,Specific,No Clouds,natural,Important,basic,Traffic accident,1,0,,
187,187,59248,82299,Fujairah,Civil Defense Center - against us,Police and traffic,3/29/2013,2013/03/29-11:00,2013/03/29-11:03,2013/03/29-11:05,3/29/2013 11:06,2013/03/29-11:07,2013/03/29-11:24,Transportation accidents,One hundredth,Cars,Public facilities and services,Streets and squares,Al -Aqa area/Dibba Al -Fujairah,Ambulance and transfer of a person,Missing,No Clouds,natural,Important,basic,Traffic accident,1,0,,
188,188,59249,82300,Al Dhafra,Civil Defense Center - Port,Police and traffic,3/29/2013,2013/03/29-08:15,2013/03/29-08:30,2013/03/29-08:35,3/29/2013 8:36,2013/03/29-08:37,2013/03/29-09:00,Transportation accidents,Clash,Cars,Public facilities and services,Public places and places,The main street is the long -standing life,Ambulance and transfer of a person,Cars,No Clouds,natural,Important,basic,Traffic accident,1,0,,
189,189,59261,82312,Ras Al Khaimah,Civil Defense Center - Administration,Police and traffic,3/30/2013,2013/03/30-18:04,2013/03/30-18:07,2013/03/30-18:10,3/30/2013 18:11,2013/03/30-18:15,2013/03/30-18:44,Transportation accidents,Run over,the person,commercial,Commercial market,Ras Al Khaimah at Fresh Al Farouj Restaurant,Transfer,governmental,No Clouds,natural,Important,basic,Traffic accident,1,0,,
190,190,59267,82318,Al Dhafra,Civil Defense Center - Port,The audience,3/31/2013,2013/03/31-12:20,2013/03/31-12:35,2013/03/31-12:37,3/31/2013 12:39,2013/03/31-12:40,2013/03/31-13:50,Transportation accidents,Deterioration,the person,governmental,unknown,An accident indicating the deterioration of a fire bike without the numbers of the area,take actions,Kitchens,No Clouds,natural,Important,basic,Traffic accident,1,0,,
191,191,59268,82319,Ras Al Khaimah,Civil Defense Center - Al -Jazeera Al -Hamra,Police and traffic,3/31/2013,2013/03/31-14:15,2013/03/31-14:19,2013/03/31-14:40,3/31/2013 14:48,2013/03/31-14:50,2013/03/31-15:03,Transportation accidents,Deterioration,Trucks,Public facilities and services,Streets and squares,Mohammed bin Zayed Street - Exit 119,Ambulance and transfer of a person,Missing,No Clouds,natural,Normal,basic,it is not determined yet,1,0,,
192,192,59279,82330,Al Dhafra,Civil Defense Center - Liwa,The audience,4/1/2013,2013/04/01-09:55,2013/04/01-10:35,2013/04/01-10:37,4/1/2013 10:39,2013/04/01-10:40,2013/04/01-12:00,Transportation accidents,Deterioration,the person,governmental,car,Car No. 26124 A Disparent in Hilux Cap,take actions,renting cars,No Clouds,natural,very important,basic,Traffic accident,1,0,,
193,193,59287,82338,Fujairah,Civil Defense Center - against us,Police and traffic,4/1/2013,2013/04/01-19:30,2013/04/01-19:34,2013/04/01-19:36,4/1/2013 19:37,2013/04/01-19:38,2013/04/01-20:05,Transportation accidents,Run over,the person,Other places,unknown,Roll region against us Fujairah,Ambulance and transfer of a person,Missing,No Clouds,natural,very important,basic,Traffic accident,1,0,,
194,194,59294,82345,Ras Al Khaimah,Civil Defense Center - Administration,Police and traffic,4/2/2013,2013/04/02-11:54,2013/04/02-12:00,2013/04/02-12:02,4/2/2013 12:06,2013/04/02-12:09,2013/04/02-12:25,Transportation accidents,Run over,the person,governmental,Streets and squares,Al -Uraibi is behind the Ras Al Khaimah Sports Club,Ambulance,Specific,No Clouds,natural,very important,basic,Traffic accident,1,0,,
195,195,59299,82350,Ras Al Khaimah,Civil Defense Center - Administration,Police and traffic,4/2/2013,2013/04/02-21:45,2013/04/02-21:49,2013/04/02-21:50,4/2/2013 21:55,2013/04/02-21:57,2013/04/02-22:27,Transportation accidents,Clash,the person,governmental,Streets and squares,Golan area,Ambulance and transfer of a person,Specific,No Clouds,natural,Important,basic,Traffic accident,1,0,,
196,196,59300,82351,Umm Al Quwain,Civil Defense Center - Al -Madinah,Police and traffic,4/2/2013,2013/04/02-20:00,2013/04/02-20:02,2013/04/02-20:03,4/2/2013 20:04,2013/04/02-20:05,2013/04/02-20:09,Transportation accidents,Clash,the person,governmental,Streets and squares,King Faisal Street opposite Dubai Islamic Bank,Transfer,Missing,No Clouds,natural,Normal,basic,Traffic accident,2,0,,
197,197,59308,82359,Umm Al Quwain,Civil Defense Center - Al -Madinah,Police and traffic,4/3/2013,2013/04/03-14:45,2013/04/03-14:48,2013/04/03-14:49,4/3/2013 14:49,2013/04/03-14:49,2013/04/03-15:00,Transportation accidents,One hundredth,the person,governmental,Streets and squares,Diwan roundabout,take actions,governmental,No Clouds,natural,Normal,basic,Traffic accident,1,0,,
198,198,59313,82364,Ras Al Khaimah,Civil Defense Center - Administration,Police and traffic,4/3/2013,2013/04/03-21:45,2013/04/03-21:53,2013/04/03-21:58,4/3/2013 22:02,2013/04/03-22:03,2013/04/03-22:55,Transportation accidents,Deterioration,the person,residential,residential,Include the popularity of Baloch,Transfer,governmental,No Clouds,natural,Important,basic,Traffic accident,1,0,,
199,199,59320,82371,Ras Al Khaimah,Civil Defense Center - Administration,Police and traffic,4/4/2013,2013/04/04-13:00,2013/04/04-13:04,2013/04/04-13:06,4/4/2013 13:11,2013/04/04-13:30,2013/04/04-13:35,Transportation accidents,Clash,the person,governmental,Streets and squares,Al -Maamoura - near nationality and foreign affairs,Ambulance and transfer of a person,Missing,No Clouds,natural,Normal,basic,it is not determined yet,6,0,,
200,200,59323,82374,Ras Al Khaimah,Civil Defense Center - Administration,Police and traffic,4/4/2013,2013/04/04-15:58,2013/04/04-16:02,2013/04/04-16:08,4/4/2013 16:12,2013/04/04-16:15,2013/04/30-16:30,Transportation accidents,Deterioration,the person,governmental,unknown,Golan area,take actions,Missing,No Clouds,natural,Important,basic,Traffic accident,1,0,,
201,201,59326,82377,Abu Dhabi,Civil Defense Center - Gentot,Police and traffic,4/4/2013,2013/04/04-12:15,2013/04/04-12:30,2013/04/04-12:35,4/4/2013 12:40,2013/04/04-13:00,2013/04/04-13:35,Transportation accidents,a fire,Cars,Means of transport,car,Al -Faya Road towards Dubai,Fire fighting,Missing,No Clouds,natural,very important,medium,Traffic accident,0,2,,
202,202,59328,82379,Ras Al Khaimah,Civil Defense Center - Administration,Civil defense departments and centers,4/4/2013,2013/04/04-19:19,2013/04/04-19:20,2013/04/04-19:25,4/4/2013 19:28,2013/04/04-19:33,2013/04/04-20:00,Transportation accidents,Clash,the person,Public facilities and services,Streets and squares,Al -Manar Center Street,take actions,Missing,No Clouds,natural,Important,basic,Traffic accident,5,0,,
203,203,59348,82399,Ras Al Khaimah,Civil Defense Center - Administration,Police and traffic,4/6/2013,2013/04/06-12:58,2013/04/06-13:03,2013/04/06-13:05,4/6/2013 13:17,2013/04/06-13:21,2013/04/06-13:33,Transportation accidents,Clash,the person,governmental,Streets and squares,The Golan near the Al Yasser School,Ambulance and transfer of a person,Specific,No Clouds,natural,Important,basic,Traffic accident,1,0,,
204,204,59354,82405,Umm Al Quwain,Raise Center,Police and traffic,4/6/2013,2013/04/06-19:05,2013/04/06-19:18,2013/04/06-19:20,4/6/2013 19:20,2013/04/06-19:21,2013/04/06-19:45,Transportation accidents,One hundredth,the person,Public facilities and services,Streets and squares,"Al -Abeer Street, directed by Sharjah",take actions,governmental,Dust and wind,natural,Normal,basic,Traffic accident,1,0,,
205,205,59357,82408,Ras Al Khaimah,Civil Defense Center - Administration,Police and traffic,4/6/2013,2013/04/06-21:57,2013/04/06-22:07,2013/04/06-22:10,4/6/2013 22:22,2013/04/06-22:24,2013/04/06-22:40,Transportation accidents,Deterioration,the person,governmental,Streets and squares,Golan area,Ambulance and transfer of a person,Specific,No Clouds,natural,Important,basic,Traffic accident,1,0,,
206,206,59359,82410,Ras Al Khaimah,Civil Defense Center - Northern Administration,Police and traffic,4/7/2013,2013/04/07-00:24,2013/04/07-00:31,2013/04/07-00:33,4/7/2013 0:36,2013/04/07-00:38,2013/04/07-00:55,Transportation accidents,Clash,the person,governmental,Streets and squares,Al -Nakheel Al -Rams Street,Ambulance and transfer of a person,Specific,No Clouds,natural,Important,basic,Traffic accident,1,0,,
207,207,59361,82412,Fujairah,Civil Defense Center - Al -Taween,Civil defense departments and centers,4/6/2013,2013/04/06-23:20,2013/04/06-23:25,2013/04/06-23:26,4/6/2013 23:27,2013/04/06-23:31,2013/04/07-00:20,Transportation accidents,Clash,Missing,Other places,Streets and squares,Performing roundabout - Ras Al Khaimah,Ambulance and rescue,Missing,No Clouds,natural,Important,basic,Traffic accident,2,0,,
208,208,59362,82413,Ras Al Khaimah,Civil Defense Center - Al -Jazeera Al -Hamra,Police and traffic,4/7/2013,2013/04/07-03:04,2013/04/07-03:06,2013/04/07-03:08,4/7/2013 3:29,2013/04/07-03:33,2013/04/07-03:55,Transportation accidents,Clash,the person,governmental,Streets and squares,Al -Jazeera Al -Hamra after Al Hamra Mall,Ambulance and transfer of a person,Specific,No Clouds,natural,very important,basic,Maafal/deliberate/by an actor,1,0,,
209,209,59363,82414,Ras Al Khaimah,Civil Defense Center - Al -Jazeera Al -Hamra,Police and traffic,4/7/2013,2013/04/07-05:42,2013/04/07-05:49,2013/04/07-05:51,4/7/2013 6:10,2013/04/07-06:18,2013/04/07-06:45,Transportation accidents,infection,the person,governmental,Streets and squares,Al -Tuwayen Street,Ambulance and transfer of a person,Specific,No Clouds,natural,Important,basic,Traffic accident,1,0,,
210,210,59365,82416,Ras Al Khaimah,Civil Defense Center - Administration,Police and traffic,4/7/2013,2013/04/07-07:22,2013/04/07-07:26,2013/04/07-07:28,4/7/2013 7:31,2013/04/07-07:33,2013/04/07-07:48,Transportation accidents,Clash,the person,governmental,Streets and squares,Al -Mairid area,Ambulance and transfer of a person,Missing,No Clouds,natural,very important,basic,Traffic accident,1,0,,
211,211,59367,82418,Al Dhafra,Civil Defense Center - Port,Police and traffic,4/7/2013,2013/04/07-10:00,2013/04/07-10:25,2013/04/07-10:27,4/7/2013 10:29,2013/04/07-10:31,2013/04/07-11:05,Transportation accidents,Clash,Trucks,Public facilities and services,Public places and places,Liners of the public street towards commodities,Ambulance and transfer of a person,Cars,Dust and wind,natural,Important,basic,Traffic accident,1,0,,
212,212,59369,82420,Ras Al Khaimah,Civil Defense Center - Kadra,Police and traffic,4/7/2013,2013/04/07-12:40,2013/04/07-12:45,2013/04/07-12:47,4/7/2013 12:49,2013/04/07-12:52,2013/04/07-12:58,Transportation accidents,Clash,the person,governmental,Streets and squares,Thorn,Ambulance and transfer of a person,Missing,No Clouds,natural,very important,basic,Traffic accident,1,0,,
213,213,59373,82424,Ras Al Khaimah,Civil Defense Center - Al -Jazeera Al -Hamra,Police and traffic,4/7/2013,2013/04/07-13:35,2013/04/07-13:38,2013/04/07-13:43,4/7/2013 13:50,2013/04/07-14:05,2013/04/07-14:20,Transportation accidents,Clash,the person,Public facilities and services,Streets and squares,The Red Island near the Akassia Hotel,Ambulance and transfer of a person,Missing,No Clouds,natural,Normal,basic,Traffic accident,1,0,,
214,214,59393,82444,Umm Al Quwain,Civil Defense Center - Administration,Police and traffic,4/8/2013,2013/04/08-13:12,2013/04/08-13:19,2013/04/08-13:20,4/8/2013 13:21,2013/04/08-13:22,2013/04/08-14:05,Transportation accidents,Deterioration,Missing,Other places,Streets and squares,New industrial / mother of foxes,Transfer,Missing,No Clouds,natural,unclassified,basic,Traffic accident,3,0,,
215,215,59398,82449,Umm Al Quwain,Civil Defense Center - Al -Madinah,Police and traffic,4/8/2013,2013/04/08-21:44,2013/04/08-21:46,2013/04/08-21:47,4/8/2013 21:48,2013/04/08-21:50,2013/04/08-21:58,Transportation accidents,Clash,the person,Other places,Streets and squares,King Faisal Street next to the deer cafe,Transfer,Missing,No Clouds,natural,Normal,basic,Traffic accident,1,0,,
216,216,59402,82453,Ras Al Khaimah,Civil Defense Center - Northern Administration,Police and traffic,4/8/2013,2013/04/08-23:08,2013/04/08-23:13,2013/04/08-23:14,4/8/2013 23:15,2013/04/08-23:16,2013/04/09-00:05,Transportation accidents,Clash,the person,governmental,Streets and squares,Al Ras area,Ambulance and transfer of a person,Specific,No Clouds,natural,Important,basic,Traffic accident,1,0,,
217,217,59407,82458,Ras Al Khaimah,Civil Defense Center - Administration,Police and traffic,4/9/2013,2013/04/09-14:50,2013/04/09-14:54,2013/04/09-14:55,4/9/2013 14:58,2013/04/09-15:00,2013/04/09-15:25,Transportation accidents,Clash,the person,governmental,Streets and squares,Al -Mairid,Ambulance and transfer of a person,Specific,No Clouds,natural,Important,basic,Traffic accident,1,0,,
218,218,59408,82459,Umm Al Quwain,Civil Defense Center - Al -Madinah,Police and traffic,4/9/2013,2013/04/09-15:23,2013/04/09-15:30,2013/04/09-15:32,4/9/2013 15:33,2013/04/09-15:35,2013/04/09-15:50,Transportation accidents,Clash,Cars,Public facilities and services,Streets and squares,Old industrial beside Al -Jabri wash,take actions,governmental,No Clouds,natural,Normal,basic,Traffic accident,1,0,,
219,219,59426,82477,Ras Al Khaimah,Civil Defense Center - Al -Jazeera Al -Hamra,Police and traffic,4/10/2013,2013/04/10-17:05,2013/04/10-17:06,2013/04/10-17:27,4/10/2013 17:45,2013/04/10-17:47,2013/04/10-17:58,Transportation accidents,Clash,the person,Public facilities and services,Streets and squares,Al -Jazeera Al -Hamra - near Al Hamra Mall,Ambulance and transfer of a person,Missing,No Clouds,natural,Normal,basic,Traffic accident,1,0,,
220,220,59451,82502,Fujairah,Civil Defense Center - against us,Police and traffic,4/12/2013,2013/04/12-16:56,2013/04/12-17:00,2013/04/12-17:02,4/12/2013 17:03,2013/04/12-17:04,2013/04/12-17:53,Transportation accidents,Clash,Missing,Public facilities and services,Streets and squares,Al -Aqa - Dibba Al -Fujairah,Ambulance and rescue,Missing,I did not specify,natural,Important,basic,Traffic accident,4,0,,
221,221,59457,82508,Ras Al Khaimah,Civil Defense Center - Administration,Police and traffic,4/13/2013,2013/04/13-03:02,2013/04/13-03:05,2013/04/13-03:07,4/13/2013 3:10,2013/04/13-03:12,2013/04/13-03:35,Transportation accidents,Clash,the person,governmental,Streets and squares,Palm intersection Al -Manar Center,Ambulance and transfer of a person,Specific,No Clouds,natural,Important,basic,Traffic accident,1,0,,
222,222,59464,82515,Ras Al Khaimah,Civil Defense Center - Administration,Police and traffic,4/13/2013,2013/04/13-18:25,2013/04/13-18:28,2013/04/13-18:30,4/13/2013 18:33,2013/04/13-18:48,2013/04/13-18:55,Transportation accidents,Clash,the person,Public facilities and services,Streets and squares,Al -Manar Street - Al -Nakheel,Ambulance and transfer of a person,Missing,No Clouds,natural,Normal,basic,Traffic accident,1,0,,
223,223,59466,82517,Ras Al Khaimah,Civil Defense Center - Administration,Police and traffic,4/13/2013,2013/04/13-20:32,2013/04/13-20:34,2013/04/13-20:37,4/13/2013 20:40,2013/04/13-20:50,2013/04/13-21:00,Transportation accidents,Clash,the person,Public facilities and services,Streets and squares,Palm - opposite Al Hilal Bank,Ambulance and transfer of a person,Missing,No Clouds,natural,Normal,basic,Traffic accident,5,0,,
224,224,59473,82524,Ras Al Khaimah,Civil Defense Center - Al -Jazeera Al -Hamra,Police and traffic,4/14/2013,2013/04/14-08:57,2013/04/14-09:05,2013/04/14-09:07,4/14/2013 9:08,2013/04/14-09:10,2013/04/14-10:00,Transportation accidents,Deterioration,the person,Industrial,Industrial,Al -Jazeera Al -Hamra at the Zamil Iron Factory,Transfer,Ready -made buildings,No Clouds,natural,Important,basic,Traffic accident,3,0,,
225,225,59481,82532,Ras Al Khaimah,Civil Defense Center - Northern Administration,Police and traffic,4/15/2013,2013/04/15-10:25,2013/04/15-10:28,2013/04/15-10:35,4/15/2013 10:35,2013/04/15-10:40,2013/04/15-11:11,Transportation accidents,Clash,the person,Public facilities and services,Methods and transport facilities,Rams opposite the club,Transfer,governmental,No Clouds,natural,Important,basic,it is not determined yet,3,0,,
226,226,59483,82534,Ras Al Khaimah,Civil Defense Center - Al -Jazeera Al -Hamra,Police and traffic,4/15/2013,2013/04/15-13:07,2013/04/15-13:09,2013/04/15-13:11,4/15/2013 13:14,2013/04/15-13:16,2013/04/15-13:54,Transportation accidents,Clash,the person,governmental,Streets and squares,Al -Jazeera Al -Hamra opposite the Ras Al -Khaimah Sarmik,Ambulance and transfer of a person,Specific,No Clouds,natural,Important,basic,Traffic accident,1,0,,
227,227,59484,82535,Umm Al Quwain,Civil Defense Center - Administration,Police and traffic,4/15/2013,2013/04/15-16:15,2013/04/15-16:17,2013/04/15-16:18,4/15/2013 16:19,2013/04/15-16:20,2013/04/15-17:01,Transportation accidents,Clash,Cars,Public facilities and services,Public places and places,Near horse roundabout,Ambulance and transfer of a person,Cars,No Clouds,natural,Normal,basic,Traffic accident,1,0,,
228,228,59485,82536,Ras Al Khaimah,Civil Defense Center - Administration,Police and traffic,4/15/2013,2013/04/15-16:54,2013/04/15-16:57,2013/04/15-16:58,4/15/2013 17:00,2013/04/15-17:03,2013/04/15-17:34,Transportation accidents,Clash,the person,governmental,Streets and squares,Al -Uraibi Street cut off,Ambulance and transfer of a person,Specific,No Clouds,natural,Important,basic,Traffic accident,2,0,,
229,229,59486,82537,Ras Al Khaimah,Civil Defense Center - Al -Jazeera Al -Hamra,Police and traffic,4/15/2013,2013/04/15-18:05,2013/04/15-18:08,2013/04/15-18:10,4/15/2013 18:13,2013/04/15-18:15,2013/04/15-18:56,Transportation accidents,Run over,the person,governmental,Streets and squares,The Red Island,Ambulance and transfer of a person,Specific,No Clouds,natural,Important,basic,Traffic accident,1,0,,
230,230,59492,82543,Ras Al Khaimah,Civil Defense Center - Kadra,Police and traffic,4/16/2013,2013/04/16-07:30,2013/04/16-07:37,2013/04/16-07:42,4/16/2013 7:44,2013/04/16-07:45,2013/04/16-07:50,Transportation accidents,Clash,the person,governmental,undefined,Class Wadi I describe me,Transfer,candies,No Clouds,natural,Important,basic,Traffic accident,1,0,,
231,231,59497,82548,Fujairah,Civil Defense Center - Masafi,Civil defense departments and centers,4/16/2013,2013/04/16-08:28,2013/04/16-08:31,2013/04/16-08:33,4/16/2013 8:34,2013/04/16-08:35,2013/04/16-08:40,Transportation accidents,Clash,Cars,Public facilities and services,Streets and squares,Masafi area,Ambulance and transfer of a person,Missing,No Clouds,natural,Important,basic,Traffic accident,2,0,,
232,232,59499,82550,Abu Dhabi,Civil Defense Center - Al -Shamkha,Police and traffic,4/16/2013,2013/04/16-14:20,2013/04/16-14:26,2013/04/16-14:30,4/16/2013 15:00,2013/04/16-15:30,2013/04/16-15:45,Transportation accidents,Clash,Cars,governmental,car,Show exhibitions in Al -Shamkha district 17,Ambulance and rescue,Missing,No Clouds,natural,unclassified,basic,Traffic accident,0,0,,
233,233,59507,82606,Ras Al Khaimah,Civil Defense Center - Administration,Police and traffic,4/17/2013,2013/04/17-12:45,2013/04/17-12:50,2013/04/17-12:53,4/17/2013 12:56,2013/04/17-12:58,2013/04/17-13:20,Transportation accidents,One hundredth,the person,governmental,Streets and squares,Al Montaser Street,Ambulance and transfer of a person,Missing,No Clouds,natural,very important,basic,Traffic accident,1,0,,
234,234,59509,82608,Ajman,Civil Defense Center - Administration,Military officers and members,4/17/2013,2013/04/17-10:00,2013/04/17-10:01,2013/04/17-10:01,4/17/2013 10:11,2013/04/17-10:14,2013/04/17-10:15,Transportation accidents,Clash,Missing,Other places,Streets and squares,Industrial Al -Jarf area near Al -Jarf Center,Transfer,Missing,No Clouds,natural,Normal,basic,Traffic accident,0,0,,
235,235,59510,82609,Fujairah,Civil Defense Center - Dibba,Police and traffic,4/17/2013,2013/04/17-16:10,2013/04/17-16:13,2013/04/17-16:16,4/17/2013 16:17,2013/04/17-16:18,2013/04/17-16:30,Transportation accidents,Clash,Cars,governmental,unknown,Market Zone - Dibba Fujairah,Ambulance,Missing,No Clouds,natural,very important,basic,Traffic accident,3,0,,
236,236,59520,82619,Fujairah,Civil Defense Center - Al -Taween,Civil defense departments and centers,4/18/2013,2013/04/18-12:40,2013/04/18-12:45,2013/04/18-12:50,4/18/2013 12:54,2013/04/18-12:55,2013/04/18-13:12,Transportation accidents,Clash,Trucks,governmental,unknown,Al -Tawyin roundabout,Exit and transfer injured people,Missing,No Clouds,natural,very important,basic,Traffic accident,1,0,,
237,237,59523,82622,Ras Al Khaimah,Civil Defense Center - Administration,Police and traffic,4/18/2013,2013/04/18-14:02,2013/04/18-14:06,2013/04/18-14:08,4/18/2013 14:12,2013/04/18-14:14,2013/04/18-14:42,Transportation accidents,Clash,the person,governmental,Streets and squares,Golan area,Ambulance and transfer of injured and deceased,Specific,No Clouds,natural,Important,basic,Traffic accident,3,0,,
238,238,59527,82626,Ras Al Khaimah,Civil Defense Center - Administration,Police and traffic,4/18/2013,2013/04/18-21:51,2013/04/18-21:53,2013/04/18-21:57,4/18/2013 22:10,2013/04/18-22:14,2013/04/18-22:20,Transportation accidents,Run over,the person,governmental,Streets and squares,Palm,Ambulance and transfer of a person,Specific,No Clouds,natural,Important,basic,Traffic accident,1,0,,
239,239,59531,82630,Al Dhafra,Civil Defense Center - Dalma,Police and traffic,4/19/2013,2013/04/19-01:05,2013/04/19-01:08,2013/04/19-01:11,4/19/2013 1:13,2013/04/19-01:18,2013/04/19-02:05,Transportation accidents,One hundredth,sidewalk,governmental,unknown,"Dalma at the Lacha roundabout, 1 kilo from a center",take actions,furniture,No Clouds,natural,very important,basic,Traffic accident,3,0,,
240,240,59536,82635,Fujairah,Civil Defense Center - against us,Police and traffic,4/19/2013,2013/04/19-03:51,2013/04/19-04:00,2013/04/19-04:02,4/19/2013 4:04,2013/04/19-04:05,2013/04/19-04:50,Transportation accidents,Clash,Missing,Public facilities and services,Streets and squares,Badia - Dibba Al -Fujairah,rescue,Missing,I did not specify,natural,Important,basic,Traffic accident,1,0,,
241,241,59564,82663,Ras Al Khaimah,Civil Defense Center - Administration,Police and traffic,4/21/2013,2013/04/21-12:00,2013/04/21-12:01,2013/04/21-12:06,4/21/2013 12:10,2013/04/21-12:12,2013/04/21-12:42,Transportation accidents,Clash,the person,governmental,Streets and squares,Palm area,Ambulance and transfer of a person,Missing,No Clouds,natural,very important,basic,Traffic accident,2,0,,
242,242,59572,82671,Ajman,Civil Defense Center - Administration,Police and traffic,4/21/2013,2013/04/21-15:55,2013/04/21-15:58,2013/04/21-16:05,4/21/2013 16:15,2013/04/21-16:25,2013/04/21-17:15,Transportation accidents,Clash,Missing,commercial,Fuel supply station,Swan fuel station in exchange for facilitation,take actions,Missing,No Clouds,natural,very important,basic,it is not determined yet,1,0,,
243,243,59579,82678,Abu Dhabi,Civil Defense Center - Gentot,Civil defense departments and centers,4/4/2013,2013/04/04-12:15,2013/04/04-12:22,2013/04/04-12:23,4/4/2013 12:36,2013/04/04-13:28,2013/04/04-13:35,Transportation accidents,a fire,Cars,governmental,car,Abu Dhabi Dubai Dubai,take actions,Cars,No Clouds,natural,very important,medium,Traffic accident,2,1,,
244,244,59587,82686,Abu Dhabi,Civil Defense Center - Al Samha,Other parties,4/18/2013,2013/04/22-14:18,2013/04/22-14:22,2013/04/22-14:30,4/22/2013 14:35,2013/04/22-14:45,2013/04/22-15:00,Transportation accidents,Deterioration,Cars,Other places,car,A car deterioration in Al -Sumaih area towards Abu Dhabi,take actions,Cars,No Clouds,natural,Important,basic,it is not determined yet,0,0,,
245,245,59593,82692,Ras Al Khaimah,Civil Defense Center - Administration,Police and traffic,4/22/2013,2013/04/22-07:48,2013/04/22-07:53,2013/04/22-07:55,4/22/2013 8:03,2013/04/22-08:10,2013/04/22-08:50,Transportation accidents,Clash,the person,governmental,Streets and squares,Al -Seih area near Ras Al Khaimah Club,Ambulance and transfer of a person,Specific,No Clouds,natural,very important,basic,Traffic accident,3,0,,
